post_id,timestamp,author,title,text,score,num_comments,link_flair_text,permalink,stickied,locked,upvote_ratio
1mhg5cu,2025-08-04 15:13:18+00:00,wombocombodumbo,Check your gift card balance as soon as you get your gift card delivered,"[PSA](https://www.reddit.com/r/Lululemen/?f=flair_name%3A%22PSA%22) TL;DR: check your gift card balance as soon as you get it delivered. Someone may have gotten all the info they needed by opening your envelope (either in transit or when it got delivered) and requested the gift card to be re-delivered as an e-gift card to a newly created email by declaring it as lost after it got marked delivered. Just finished reaching out to an Educator through live chat on Lululemon's website (Canada if that changes anything). Long story short, I ordered a $200 gift card to make use of an Amex promo (spend 200, get 50 back). It arrived on June 26th. This isn't my first gift card that I get delivered from lululemon (maybe my 6th?). Never left the vicinity of my home and I never revealed the PIN. That is, until yesterday night when I was going to use to place an order on their online store. As I put in the gift card number + PIN, it comes out at a $0 balance. Reached out to Lulu CS this morning, the Educator tells me the following: ""It looks like you reached out to us on June 26 when the gift card got marked delivered that you couldn't locate the package so the card was drained and replaced with an e-gift card which is an emailed version."" Now this is a while ago, and I remember contacting CS for a certain business, but I didn't remember if it was Lululemon or another company. So I ask them to which email this e-Gift card was sent to. Lo and behold, it was sent to an email that a scammer created: [insertmyname945@gmail.com](mailto:insertmyname945@gmail.com) I firmly tell the educator that that is not my email and provided the email addresses that are actually mine. She asks: ""Okay could it have been someone that you know? They had your full order ID and could confirm all your order information."" Told her that my assumption is they opened the envelope containing the gift card to get access to my order ID and order info then resealed it. I also confirmed with the Educator that I do not remember contacting Lululemon on June 26th concerning this package. I also told her that I did not understand why the previous chat agent would not have instead sent it to the original email with which the order was initially placed and had it sent to this random email. She could not speak to the prior interaction. In the end, a case has been opened with the Resolutions support team and I should be hearing back in 1-3 business days. Worst case scenario, I'll go ahead with a chargeback with my Amex card, but the time wasted is just a bummer.",25,6,Review,https://www.reddit.com/r/lululemon/comments/1mhg5cu/check_your_gift_card_balance_as_soon_as_you_get/,False,False,0.86
1mhg2me,2025-08-04 15:10:27+00:00,runandplay2,Pool Party for the Monday Blues🌊⛱️💙,Picked up the Evolve Energy longline bra a few weeks ago to complete my set. I was so happy to find it in store. I've yet to see it online but hopefully soon. Pool Party in WT leggings (4) and Evolve longline energy bra (s),202,18,Fit Pics,https://www.reddit.com/r/lululemon/comments/1mhg2me/pool_party_for_the_monday_blues/,False,False,0.98
1mhfzmi,2025-08-04 15:07:15+00:00,takeatravel,I think rainforest green is my new fav color,Top is “bend this scoop and square”,83,15,Fit Pics,https://www.reddit.com/r/lululemon/comments/1mhfzmi/i_think_rainforest_green_is_my_new_fav_color/,False,False,0.95
1mhdzvb,2025-08-04 13:50:23+00:00,Infinite_Hat5261,I’m a nomad 🍂,Today’s fit features: - Jersey Training Short Sleeve T-shirt in Fog Green - Wunder Train with Pockets 25” in Nomad - Wunder Train C/D Bra in Nomad,16,1,Fit Pics,https://www.reddit.com/r/lululemon/comments/1mhdzvb/im_a_nomad/,False,False,0.79
1mhdpy3,2025-08-04 13:39:16+00:00,persimmoncove,OOTD 🌸🐬🍇,Items pictured *aero blue* - XS/S - funnel neck scuba * Delilah Mauve* - size 6 - high neck align tank *chilled grape* - size 6 - 6” Wunder train shorts,73,13,Fit Pics,https://www.reddit.com/r/lululemon/comments/1mhdpy3/ootd/,False,False,0.96
1mhc82o,2025-08-04 12:35:45+00:00,mal2600,Everywhere Belt Bag XL 4L - Need a Dupe,"I need some help. I fell in love with the Everwhere Belt Bag Extra Large 4L... I'm glad I didn't buy one and then face disappointment at home, but I did take the time to find a store near me to try one on my body. I am 5'4"", 250 lbs, recently down 60 lbs, and I was hoping this bag would fit my body. There are no strap length measurements online - should have been a clue - and I couldn't find anyone similar to my body in photos/online research, and it is about 2"" shy of ideal comfort for me. I love the pockets and organizing space in the main compartment. I love the look, I'm casual by nature, and this bag fits my everyday style. TL;DR - This bag is too small to fit around my body, but I love it and need options for a similar dupe with a 50"" strap.",0,7,Dupe,https://www.reddit.com/r/lululemon/comments/1mhc82o/everywhere_belt_bag_xl_4l_need_a_dupe/,False,False,0.5
1mh9b04,2025-08-04 10:00:30+00:00,MyDogIsTheBest01,Pace rival shorts high rise 5”,Does anyone have a picture of these on? I usually prefer a longer short but I’m not sure if these look too long.,5,3,Request,https://www.reddit.com/r/lululemon/comments/1mh9b04/pace_rival_shorts_high_rise_5/,False,False,0.78
1mh8dpt,2025-08-04 09:01:05+00:00,lululemonmods,Monday Pre-Drop Discussion Thread,"Hi everyone, hope you all had an amazing weekend! What better way to start to kick the week off than discussing what we're hoping to see released tomorrow? Here's the place to chat about all your pre-drop hopes, dreams, and grievances, and everything in between. Is there anything that's being rumoured to be released, have you spotted anything new in your local store? Please feel free to tell all! Hope everyone has a great start to their week and hopefully Lulu rewards us with an amazing drop!",11,63,Discussion,https://www.reddit.com/r/lululemon/comments/1mh8dpt/monday_predrop_discussion_thread/,False,False,0.87
1mh8dpa,2025-08-04 09:01:04+00:00,lululemonmods,Weekly Simple Questions and Advice Thread,"Have a simple question that isn’t enough to warrant its own post? Now you have a place to ask it! If you are new to the sub, please read through our [FAQs](https://www.reddit.com/r/lululemon/wiki/faq/) as they address a lot of our commonly asked questions, such as ""when will \[item\] restock?"" and so much more! ID and authentication requests are allowed in this thread only. Before posting, please read through this guide on [how to read a size dot](https://www.reddit.com/r/lululemon/comments/1jrkgx3/how_to_identify_a_style_name_color_or_size_of_an/) using Lulufanatics. If you're not able to identify your item via the size dot or your item does not have a size dot, you can post a photo of your item here by clicking the ""add image"" button in the bottom left corner when writing a comment. This is meant to be a spot for sub members looking to ID their own items, not resellers looking to get IDs on multiple pieces.",5,58,Discussion,https://www.reddit.com/r/lululemon/comments/1mh8dpa/weekly_simple_questions_and_advice_thread/,False,False,1.0
1mh3ild,2025-08-04 04:02:12+00:00,juniper6173,wild berry color combo,"anyone know what color looks good with wild berry? i’m looking for something that’s the same shade of pink but lighter or darker, and not too similar but different like magenta purple.",1,4,Styling Advice,https://www.reddit.com/r/lululemon/comments/1mh3ild/wild_berry_color_combo/,False,False,0.6
1mh2662,2025-08-04 02:52:37+00:00,actualgoddessbb,Washed denim,Flowy Y bra in glow grid denim (size 8 runs so tight) Washed denim grooves (size 4) THESE ARE MY FAV ! & squat proof!,114,5,Fit Pics,https://www.reddit.com/r/lululemon/comments/1mh2662/washed_denim/,False,False,0.9
1mgyz7b,2025-08-04 00:18:13+00:00,Kind_Promise5472,Orange Obsessed,Said I would post so here she is!! Rock Melon and Tiger Aligns. Love love this color combo. I believe they only came in 6” (might still be on WMTM US) and had them hemmed to 4”. Wish there was more available in Tiger! 🧡,188,14,Fit Pics,https://www.reddit.com/r/lululemon/comments/1mgyz7b/orange_obsessed/,False,False,0.98
1mgxhdg,2025-08-03 23:09:45+00:00,Prestigious-Page-203,Are these new ?,"Negative split run shorts. Walked into a store in Florida today, saw these cuties. I saw a pair in what appeared to be a light ivory as well",52,33,In-Store Find,https://www.reddit.com/r/lululemon/comments/1mgxhdg/are_these_new/,False,False,0.94
1mgxbqu,2025-08-03 23:02:44+00:00,Anon_819,New Fast and Free Lace Trim matches the lace trim on my 2016 Sculpt It Tank,I'm so happy that they brought back this type of lace detailing. An unintentional set!,20,0,Collection,https://www.reddit.com/r/lululemon/comments/1mgxbqu/new_fast_and_free_lace_trim_matches_the_lace_trim/,False,False,0.92
1mgw1xc,2025-08-03 22:06:43+00:00,knivesoutmtb,ootd,Finally got some track that shorts. (goodnight plum) in a sized down 4. They survived (i hope) a bike crash so i’m stoked. my bloody body isn’t stoked.,22,3,Fit Pics,https://www.reddit.com/r/lululemon/comments/1mgw1xc/ootd/,False,False,0.65
1mgulqj,2025-08-03 21:07:07+00:00,PrisonLilo,Warm Ash Grey vs Nomad vs Riverstone,"from top to bottom, warm ash grey (wt bra), nomad (wt bra), riverstone (flow y). I am debating if I want to keep WAG. I am waiting on the shorts to arrive. Nomad I have bra and leggings, not shorts. They’re just sooo similar. I fear once I remove the tag I won’t be able to tell which is which 🤣",47,13,Color or Size Comparison,https://www.reddit.com/r/lululemon/comments/1mgulqj/warm_ash_grey_vs_nomad_vs_riverstone/,False,False,0.94
1mgt5dj,2025-08-03 20:10:15+00:00,markjann,Advice with sizing for leggings.,"Hi, I'm planning to buy the Lululemon Align leggings with pockets and with the front seam for my girlfriend. She is around 5'3'' and 42"" hip and around 35"" waist measurements. I think the leggings will be mainly used for light activity and also lounging inside, so I think a relaxed fit is more suitable than a tighter fit, especially for sitting compared with standing. Based on this I've read that it is better to stick with the sizing based on the waist measurement, which will be 14, If I'm correct, instead of focusing on hip size, which would be more around size 12, with length 25""?",0,17,Sizing Advice,https://www.reddit.com/r/lululemon/comments/1mgt5dj/advice_with_sizing_for_leggings/,False,False,0.38
1mgsq0d,2025-08-03 19:53:23+00:00,Salt_Poem97,chalk red align shorts,"hi everyone! i recently bought chalk red align shorts from wmtm this last thursday, but i received them today and the tag said “psrd” persian red which is a color from like 2018. did this happen to anyone else? is it just the same color, different name? too lazy to retag their inventory? thank you!",25,5,Product Question/Recommendation,https://www.reddit.com/r/lululemon/comments/1mgsq0d/chalk_red_align_shorts/,False,False,0.96
1mgs741,2025-08-03 19:32:01+00:00,CooperDoo422,Feeling tropical on a gloomy Sunday 🌴🩵🍋‍🟩,"Choose some fun colors to brighten up my gloomy Sunday! 🐠Sonic Teal/Gold Scuba Oversized Full-Zip Hoodie (xs/s) 🍋‍🟩Citra Lime Swiftly Cropped Tank Top (6) 🩵Tropics Tone Flow Y Bra (8) and Align HR 6"" Shorts (8)",218,8,Fit Pics,https://www.reddit.com/r/lululemon/comments/1mgs741/feeling_tropical_on_a_gloomy_sunday/,False,False,0.99
1mgrcf3,2025-08-03 18:58:12+00:00,steakandfruit,Rock Melon 🤝 Oil Grey,Rock melon flow y bra in size 2 and oil grey 6” align shorts in size 2!,335,10,Fit Pics,https://www.reddit.com/r/lululemon/comments/1mgrcf3/rock_melon_oil_grey/,False,False,0.99
1mgr38o,2025-08-03 18:47:56+00:00,genxista,Closest to Carharrt tan?,What’s the closest shade? Thanks in advance!,0,9,Styling Advice,https://www.reddit.com/r/lululemon/comments/1mgr38o/closest_to_carharrt_tan/,False,False,0.5
1mgoib2,2025-08-03 17:06:45+00:00,painthrowaway852,request: wine berry (WNBY) vs. other reds/burgundy/purples,"recently discovered wine berry (WNBY) and couldn't find many references for it, if anyone has this gem and could compare it to other similar colors - garnet, cassis, deep luxe, deep rouge, deep ruby, dark adobe, savannah - TIA!",31,12,Request,https://www.reddit.com/r/lululemon/comments/1mgoib2/request_wine_berry_wnby_vs_other/,False,False,0.94
1mgnels,2025-08-03 16:21:33+00:00,persimmoncove,Sunday morning stroll OOTD 🌊🥥,A little lulu for our Sunday morning family walk. 🧋🌊🥥 Items pictured: *pool party* - speed up shorts - size 6 *light ivory* - back twist ribbed tee - size 6,164,10,Fit Pics,https://www.reddit.com/r/lululemon/comments/1mgnels/sunday_morning_stroll_ootd/,False,False,0.98
1mgncfy,2025-08-03 16:19:05+00:00,heymiche,daydrift tapered!,"saw these on the site yesterday and looking for some fit pic before pulling the trigger, bonus points for petite pics",8,7,Request,https://www.reddit.com/r/lululemon/comments/1mgncfy/daydrift_tapered/,False,False,0.84
1mgn0e1,2025-08-03 16:05:20+00:00,AcceptableObject,Iced Iris & Purple Ash 💜,"Quiet within bra (8), aligns (4). Loooveeee this bra so much for upper body days.",74,6,Fit Pics,https://www.reddit.com/r/lululemon/comments/1mgn0e1/iced_iris_purple_ash/,False,False,0.94
1mglbyq,2025-08-03 14:57:18+00:00,ArmWarm8743,Organic Cotton Baby Tee vs Collegiate,"Edit: Nm…just logged in on my computer to see that the collegiate gray one has the Lululemon lettering on the shirt. I guess I need to visit the eye doctor because I could not see them on my phone. 😑 Does anyone know the difference between the organic cotton baby tee versus the organic cotton baby tee collegiate? I purchased the collegiate one and love the fit. It only shows two color options for the collegiate fit, but there are four colors for the regular one and I cannot figure out the difference. They don’t have them in any of the stores near me so I can’t see the difference in person.",3,5,Product Question/Recommendation,https://www.reddit.com/r/lululemon/comments/1mglbyq/organic_cotton_baby_tee_vs_collegiate/,False,False,0.71
1mgl0mu,2025-08-03 14:44:07+00:00,tinanguyenn,gray + blue,been loving blues and grays together lately! workout fit for pilates + barre this morning. wearing graphite gray align 25” and the focuser bra in starch blue. this is probably one of my new favorites to work out in!,148,1,Fit Pics,https://www.reddit.com/r/lululemon/comments/1mgl0mu/gray_blue/,False,False,0.98
1mgjt6w,2025-08-03 13:53:00+00:00,cryifyouwantto,Size 10-12 Recommendations,"6 months postpartum with my third baby in 5 years. Through every pregnancy and postpartum I have lived in my align leggings and joggers but I’m ready to start looking a bit more put together. I’m about 50 lbs heavier now than I was prior to kids so styling my body has been very challenging for me, as well as with the logistics of hauling a group of kids to the mall for try ons! Are there any tried and true pieces that flatter a size 10-12 body? I’m 5 foot 7”. Specifically pants and tops. Thanks!",7,18,Product Question/Recommendation,https://www.reddit.com/r/lululemon/comments/1mgjt6w/size_1012_recommendations/,False,False,0.67
1mgi0fc,2025-08-03 12:27:52+00:00,Allllllexissssss,sunny coral & Minimal tank 🧡👽,inner glow shorts in sunny coral & lululemon minimal tank in heathered power grey,28,5,Fit Pics,https://www.reddit.com/r/lululemon/comments/1mgi0fc/sunny_coral_minimal_tank/,False,False,0.78
1mgelp6,2025-08-03 09:00:41+00:00,lululemonmods,Sunday Rave Thread,Finally found a restock on something you’ve been waiting for? Had an awesome experience in store? Tried out a new piece and you’re loving it? Let’s hear it! This is the place for all the good things! Looking to vent instead? Check out Saturday’s rant thread.,2,3,Discussion,https://www.reddit.com/r/lululemon/comments/1mgelp6/sunday_rave_thread/,False,False,0.75
1mgc2vd,2025-08-03 06:16:08+00:00,Powerful-Bug-7639,V-Neck Align Bra C/D cup - size 6 or 8?,"Hey everyone! I’m planning on buying the V-Neck Align Bra C/D cup but i’m torn on which size to get and was hoping to hear others’ experiences. I’m generally a size 6 at lulu, but when I tried this bra on (A-B cup version)in store many months ago I remember thinking it flattened my boobs/squished them in an unflattering way. I can’t currently get to a store to try this one on! Does the C/D cup do the same thing? I’m a 34C :) Thanks everyone!",1,15,Sizing Advice,https://www.reddit.com/r/lululemon/comments/1mgc2vd/vneck_align_bra_cd_cup_size_6_or_8/,False,False,0.67
1mg7k4k,2025-08-03 02:05:11+00:00,nono1501,Got a Washed Blue Ribbed Bra LAC.. Want to match it with?,"Got this bra today [https://shop.lululemon.com/p/women-sports-bras/Like-a-Cloud-LL-Ribbed-BC/\_/prod10850247?color=70135](https://shop.lululemon.com/p/women-sports-bras/Like-a-Cloud-LL-Ribbed-BC/_/prod10850247?color=70135) and always find great inspo here on how to match different colors so it's not boring, but for this color, I'm a bit stuck... I have either Aligns/Wunder train in: Passionate, Magenta Smoke, Raspberry Coulis, Hawaiian Blue, Cerulean Blue, Garnet, Nightfall, Navy, and Black.",7,9,Styling Advice,https://www.reddit.com/r/lululemon/comments/1mg7k4k/got_a_washed_blue_ribbed_bra_lac_want_to_match_it/,False,False,0.82
1mg60dw,2025-08-03 00:45:34+00:00,nululumumumelon,"[image trick finds] scubaOSFZH (BLLP), scubaOSHZH (TRQB, LARK, gully green), align23"" (BLTW, NIGH), alignpckts23"" (sequoia), align25"" (sequoia, LURD), align28"" (sequoia), WT23"" (BLTW), WT25"" (BLTW), WT28"" (BALF), GU25"" (sequoia, BLTW), GU28"" (sequoia), scubaMROSjggrReg (BALF), WT6"" (BLTW), softstrem",,91,33,Unreleased Item,https://www.reddit.com/r/lululemon/comments/1mg60dw/image_trick_finds_scubaosfzh_bllp_scubaoshzh_trqb/,False,False,0.99
1mg4zew,2025-08-02 23:54:52+00:00,Master-Database2729,Does Mauve Gray go with Fog Green?,"I’m trying to decide if these two colors go together. I have the long sleeve shirt in a black, but I was trying to figure out if the mauve gray goes with the fog green?",51,23,Styling Advice,https://www.reddit.com/r/lululemon/comments/1mg4zew/does_mauve_gray_go_with_fog_green/,False,False,0.92
1mg2l26,2025-08-02 22:02:38+00:00,Brave_Pangolin_3757,like new logo issue,"hi everyone! so i ordered a pair of aligns from the likenew website to save some $$. they were in the good as new condition but they came with no logo? literally nothing. no tag, no logo on them. they feel like lulu but im curious if this has happened to anyone else?",1,9,Like New,https://www.reddit.com/r/lululemon/comments/1mg2l26/like_new_logo_issue/,False,False,0.6
1mg1mdf,2025-08-02 21:20:10+00:00,SimilarPurpose3127,"Denver, CO","The Lakewood Lululemon is holding a school supplies drive and if you bring in any unopened item (pencils, crayons, tissues, etc) you get 25% off your entire in store purchase, plus free gift with purchase over $150! Today only for a few more hours.",15,2,Sales and Discounts,https://www.reddit.com/r/lululemon/comments/1mg1mdf/denver_co/,False,False,0.86
1mg0pg0,2025-08-02 20:40:30+00:00,Zorroisblack,Washed blue softstreme full zip is even more beautiful in person !,,112,9,Fit Pics,https://www.reddit.com/r/lululemon/comments/1mg0pg0/washed_blue_softstreme_full_zip_is_even_more/,False,False,0.99
1mfzlf8,2025-08-02 19:52:18+00:00,runandplay2,✨🦄Mystic and LemonGrass 🍋🌿,"Ok I didn’t need another purple but I’m in love with mystic. Much better than I thought. And lemongrass is kind of a disappointment. But if you didn’t love Citra Lime, you may like lemongrass. Also, maybe it’s the hotty hots which aren’t my fave shorts. Will be interested to see how it looks in other materials. Lemongrass is like if Citra Lime and Sour Grape had a baby. Also, Mystic looks great paired with Lavender Lux if tonal is your thing Mystic Energy Longline Bra (6) Mystic WT shorts 6in (4) Lemongrass hotty hots 2.5 in (4) Starch Blue Evolve energy longline bra (s) Citra Lime Cropped swiftly tank (4) Lavender Lux Pace Rivals (4)",193,33,Fit Pics,https://www.reddit.com/r/lululemon/comments/1mfzlf8/mystic_and_lemongrass/,False,False,0.97
1mfz67t,2025-08-02 19:33:57+00:00,False-Affect-2310,top,help! does anybody know the name of the top paired with these shorts?,2,3,Product Question/Recommendation,https://www.reddit.com/r/lululemon/comments/1mfz67t/top/,False,False,0.57
1mfyqtl,2025-08-02 19:15:50+00:00,Allllllexissssss,enjoying vaca in Maine,Twist back t shirt -pink organza hculg - inner glow shorts,44,2,Fit Pics,https://www.reddit.com/r/lululemon/comments/1mfyqtl/enjoying_vaca_in_maine/,False,False,0.84
1mfx0cp,2025-08-02 18:02:07+00:00,breannazoey,Sagging/bunching in crotch after weight loss?,"I've been having this issue for the last few months with sagging/bunching. I've always been a 6 in aligns, would sizing down to a 4 probably help here? At first I thought it was just the leggings getting worn out, but it happens even with my newer/hardly worn Lulu, like this pair. I feel like it's probably weight loss related because I did lose 20 lb this year (~150 ➡️ ~130) and have lost an inch from the thighs and 1.5"" in the 🍑. Has anyone else experienced similar and if so what did you end up doing? I always hang dry, but I was wondering if I started putting them in the dryer if that would shrink them up a little over time and help? I have so many 6s and don't want to rebuild a collection of 4s because eventually I'll put a little bit of weight back on.",6,14,Sizing Advice,https://www.reddit.com/r/lululemon/comments/1mfx0cp/saggingbunching_in_crotch_after_weight_loss/,False,False,0.56
1mfvukz,2025-08-02 17:13:46+00:00,Interesting_Fox_2729,Lululemon pink haze full outfit,Such a cute colour,51,4,Fit Pics,https://www.reddit.com/r/lululemon/comments/1mfvukz/lululemon_pink_haze_full_outfit/,False,False,0.79
1mfvoym,2025-08-02 17:07:05+00:00,kaitlyn2004,New shorts… shorter inseams?!?,"I have a few speed up shorts but lately have been using almost exclusively Hotty hot. Both in 4”. Never tried the track that 5” but it also always seems sold out! I also use them almost exclusively for running. Lately they have a few new models of shorts, but they are all shorter inseams. I’m 6’ tall and worry the 2” are just absolutely too short for my height and my butt! But what about the 3/3.5” ones? Would they still be noticeably shorter than my 4” Hotty hot?",2,5,Product Question/Recommendation,https://www.reddit.com/r/lululemon/comments/1mfvoym/new_shorts_shorter_inseams/,False,False,0.67
1mfvfuz,2025-08-02 16:56:37+00:00,nululumumumelon,"[image trick finds] PB Lined7"" (SOGY), PB Lnrlss5"" (SRNB, WSHG, sunburst orange), ZI Lnrlss5"" (sunburst orange), EBBextnd (ROWD), EBBLong1L (pink frosting, WSHG), alignTank (PLMD), LaC (BLTW), LaC LL (RNFG), LaC Spag (BLTW), WTstrappyBra (BLTW, FOGN), catesT (BLBT), HT SS (BLTW), Defines (SQUO)",,74,15,Unreleased Item,https://www.reddit.com/r/lululemon/comments/1mfvfuz/image_trick_finds_pb_lined7_sogy_pb_lnrlss5_srnb/,False,False,0.99
1mftq5j,2025-08-02 15:44:51+00:00,Admirable-Grass-109,OTTD ♥️🖤🐞,"Living in Atlanta means you always have red black and white on deck- Falcons, Hawks, Bulldogs, Brave- (Navy but close enough) Black high neck align size 10 Hot Heat 6in biker shorts size 10 Black define jacket size 8 ✌🏻 ⬆️ A town 👇🏼😜",165,6,Fit Pics,https://www.reddit.com/r/lululemon/comments/1mftq5j/ottd/,False,False,0.96
1mft76n,2025-08-02 15:23:05+00:00,Decision_Burner,Silicone straw tip Tumbler,"Hi, as the title states, how and where do I get a replacement silicone straw tip for the 40oz Insulated tumbler?",4,2,Product Question/Recommendation,https://www.reddit.com/r/lululemon/comments/1mft76n/silicone_straw_tip_tumbler/,False,False,0.75
1mfmmu8,2025-08-02 09:46:45+00:00,Beginning_Pepper_316,Lululemon define jacket,"Hi, im buying a define jacket but i was wondering if someone could post a picture of the other side of the pocket zipper. Does the back side also have the stamped logo? Thanks!",0,4,Product Question/Recommendation,https://www.reddit.com/r/lululemon/comments/1mfmmu8/lululemon_define_jacket/,False,False,0.33
1mfmhqa,2025-08-02 09:37:24+00:00,Bettygirl78,Wunder Train HR shorts 6” True Navy (8),"I love the Wunder train tights, but the shorts are just as good & I don’t know y I haven’t been giving them the same amount of love. Need to change that. Even the needy dog agrees ;)",34,6,Fit Pics,https://www.reddit.com/r/lululemon/comments/1mfmhqa/wunder_train_hr_shorts_6_true_navy_8/,False,False,0.91
1mfly40,2025-08-02 09:00:43+00:00,lululemonmods,Saturday Rant and Unpopular Opinion Thread,"Don’t see you size in stock? The color you want hasn’t dropped? Package got lost or is taking forever to ship? Product not performing well? Can’t get through to GEC? This is the place to share your weekly Lululemon woes! Please keep the rules (in particular, rules 1 and 3) and general reddiquette in mind when posting. This isn’t a spot to call out or harass specific users of this sub! Keep an eye out for a Sunday Raves thread tomorrow to share your good news for the week, too!",0,37,Discussion,https://www.reddit.com/r/lululemon/comments/1mfly40/saturday_rant_and_unpopular_opinion_thread/,False,False,0.3
