post_id,timestamp,author,title,text,score,num_comments,link_flair_text,permalink,stickied,locked,upvote_ratio
1gmklhh,2024-11-08 15:04:34+00:00,steakandfruit,Fit Pic Friday,Wundermost Nulu Mesh long sleeve crew neck bodysuit in black and an old style Wundermost nulu triangle bralette in black!!,573,21,Fit Pics,https://www.reddit.com/r/lululemon/comments/1gmklhh/fit_pic_friday/,,,
1gloxvy,2024-11-07 12:09:53+00:00,starskynight,🍓🥛🤍,,581,15,Fit Pics,https://www.reddit.com/r/lululemon/comments/1gloxvy/_/,,,
1glmga7,2024-11-07 09:14:40+00:00,Still-Fee4,My lululemon collection worth a new car...,,498,211,Collection,https://www.reddit.com/r/lululemon/comments/1glmga7/my_lululemon_collection_worth_a_new_car/,,,
1glcwsw,2024-11-06 23:51:16+00:00,,Storm teal set,"Honestly, not my fav set but super comfy and great for work outs. Storm teal just doesn’t excite me as much as other colors! Wearing the high neck align bra size 8 and the wunder train high rise shorts size 4.",999,35,Fit Pics,https://www.reddit.com/r/lululemon/comments/1glcwsw/storm_teal_set/,,,
1gl3nfd,2024-11-06 17:17:25+00:00,yogigal7,Rawr,Truleopard Align Pants Espresso Nulu Strappy V-Neck bra Mojave Tan Full-Zip cropped hoodie *PaTiEnTlY* waiting for more leopard print items to drop 😮‍💨🤌🏽,3210,54,Fit Pics,https://www.reddit.com/r/lululemon/comments/1gl3nfd/rawr/,,,
1gkl45b,2024-11-05 23:52:52+00:00,Busy_Basil9638,A true navy set is such a staple💙💙,,657,33,Fit Pics,https://www.reddit.com/r/lululemon/comments/1gkl45b/a_true_navy_set_is_such_a_staple/,,,
1gkbwym,2024-11-05 17:19:00+00:00,Neonatalnerd,Blue willow 💙,"Blue willow pleated tennis skirt (6) and training headband. I've never worn blue before in my life, oddly enough, and I kind of love this color!",648,53,Fit Pics,https://www.reddit.com/r/lululemon/comments/1gkbwym/blue_willow/,,,
1gk5rnb,2024-11-05 12:42:36+00:00,steakandfruit,Tuesday Leg Day Fit!,Fast and free high rise shorts in magenta purple paired with energy longline bra in black!,452,7,Fit Pics,https://www.reddit.com/r/lululemon/comments/1gk5rnb/tuesday_leg_day_fit/,,,
1gjrqkp,2024-11-04 22:50:13+00:00,steakandfruit,What was your Monday movement!?,Mine was shoulders and chest day! Pictured here is align 28” leggings in heathered grey and flow Y bra im diamond dye graphite grey :),636,40,Fit Pics,https://www.reddit.com/r/lululemon/comments/1gjrqkp/what_was_your_monday_movement/,,,
1gjqjbj,2024-11-04 21:58:42+00:00,lunardownpour,Is it just me or is this giving garbage bag?,,750,127,New Online Drop or Markdown,https://www.reddit.com/r/lululemon/comments/1gjqjbj/is_it_just_me_or_is_this_giving_garbage_bag/,,,
1gjmx0t,2024-11-04 19:30:12+00:00,katiekutz,(F19) Align High-Rises in Camo is life 🖤🩶,,705,111,Fit Pics,https://www.reddit.com/r/lululemon/comments/1gjmx0t/f19_align_highrises_in_camo_is_life/,,,
1gjhyz0,2024-11-04 16:10:33+00:00,Early_Pudding6221,Pink and purple and pink and purple and 🩷💜,Dark lavender align tank X guava pink align leggings X glaze pink cropped scuba :),543,33,Fit Pics,https://www.reddit.com/r/lululemon/comments/1gjhyz0/pink_and_purple_and_pink_and_purple_and/,,,
1gj0v79,2024-11-03 23:47:16+00:00,Early_Pudding6221,"I didn’t plan to post today so the fit is basic, but Bunbun wanted to join in on my workout and you guys love him 🐰🏋🏻",Dark forest align leggings X white energy bra,1219,33,Fit Pics,https://www.reddit.com/r/lululemon/comments/1gj0v79/i_didnt_plan_to_post_today_so_the_fit_is_basic/,,,
1giyr5r,2024-11-03 22:11:28+00:00,,all black everything 🖤🖤,Black define size 2 Black aligns size 4 Aritzia super puff black and my headband is even a super old lulu headband 🥳,462,11,Fit Pics,https://www.reddit.com/r/lululemon/comments/1giyr5r/all_black_everything/,,,
1gisf6y,2024-11-03 17:38:35+00:00,Early-Technology822,Dramatic Magenta and a PSA,"Trying a new angle of pic! This is absolutely not for any dudes wanting to chat. GTFO. Dramatic Magenta Wunder Under Nulu and Align V Neck (both size 6). Also, all our gals and guys in your 20s: Wear sunscreen or you will have terrible sun spots like I do on my chest!",536,48,Fit Pics,https://www.reddit.com/r/lululemon/comments/1gisf6y/dramatic_magenta_and_a_psa/,,,
1gil5md,2024-11-03 11:53:57+00:00,starskynight,Pastels 😍,,528,5,Fit Pics,https://www.reddit.com/r/lululemon/comments/1gil5md/pastels/,,,
1ghwx4t,2024-11-02 13:52:26+00:00,steakandfruit,Team Align!!,Align sweetheart bra in black size 2 Align v waist legging in espresso 28” size 2,611,12,Fit Pics,https://www.reddit.com/r/lululemon/comments/1ghwx4t/team_align/,,,
1ghomny,2024-11-02 04:25:09+00:00,krista_weiss,nhl x lulu,rangers x belt bag -blue white swiftly short sleeve - size 4,545,76,Fit Pics,https://www.reddit.com/r/lululemon/comments/1ghomny/nhl_x_lulu/,,,
1ghhkh3,2024-11-01 22:21:04+00:00,Early_Pudding6221,BRIGHT today! 😁💚💛🩷,Sonic pink align leggings X electric lemon align tank X green punch cropped scuba!,1380,42,Fit Pics,https://www.reddit.com/r/lululemon/comments/1ghhkh3/bright_today/,,,
1ggzm5g,2024-11-01 07:00:53+00:00,stacie-summers,"Align leggings in Espresso (4), Wrap-Front Ribbed Long Sleeve (8), Align Cropped Cami Tank Top (10) ☺️",,496,2,Fit Pics,https://www.reddit.com/r/lululemon/comments/1ggzm5g/align_leggings_in_espresso_4_wrapfront_ribbed/,,,
1ggpgfs,2024-10-31 21:23:00+00:00,kirkland4ever,Baby’s first Lululemon (it’s me- I’m baby),"After years of wearing almost strictly Alo/Girlfriend, I finally ordered my first matching Lulu set! Align V Neck Bra and 6” shorts in Nightfall (camera is picking up more navy but def purple in person!) really like the cut of this bra so will have to order more sets- unfortunate news to my wallet 🤭",653,32,Fit Pics,https://www.reddit.com/r/lululemon/comments/1ggpgfs/babys_first_lululemon_its_me_im_baby/,,,
1gghri2,2024-10-31 15:50:22+00:00,Early_Pudding6221,I’ve been looking at this color combo for a while.. and I dunnooo but what do you guys think? 😬❤️💙,Dark red align leggings X Poolside align asymmetrical bra,634,81,Fit Pics,https://www.reddit.com/r/lululemon/comments/1gghri2/ive_been_looking_at_this_color_combo_for_a_while/,,,
1gg20xk,2024-10-31 00:36:04+00:00,,GARNET,"I already have this bra in bone and twilight rose but I’ve been dying to get something in Garnet and this is the only thing (besides a key ring and socks) that’s available in Aus! Hopefully that changes soon, would love a pair of matching aligns! Wearing the cross band high neck yoga bra in size 8 and the align leggings true navy size 2.",878,27,Fit Pics,https://www.reddit.com/r/lululemon/comments/1gg20xk/garnet/,,,
1gfuyx3,2024-10-30 19:26:19+00:00,,hot heat wunder train + black flow y bra ❤️🖤,size 4 in the WT - honestly should have sized up cuz the constant camel toe is annoying 😌 normally im a 4 in aligns,463,3,Fit Pics,https://www.reddit.com/r/lululemon/comments/1gfuyx3/hot_heat_wunder_train_black_flow_y_bra/,,,
1gfukyi,2024-10-30 19:09:41+00:00,Early_Pudding6221,Don’t sleep on pink and blue! 🩵💕,"Align tank in Dhalia Mauve X Align leggings in Aero blue, (both colors look warm here but they are very cool tones the top is more purpley irl )",1977,31,Fit Pics,https://www.reddit.com/r/lululemon/comments/1gfukyi/dont_sleep_on_pink_and_blue/,,,
1gfdtny,2024-10-30 03:47:18+00:00,stacie-summers,"Can‘t beat a Define jacket & Align leggings combo, right?!💕 I‘m loving all the earthy tones lately 🤎",,558,20,Fit Pics,https://www.reddit.com/r/lululemon/comments/1gfdtny/cant_beat_a_define_jacket_align_leggings_combo/,,,
1gezm9s,2024-10-29 17:02:13+00:00,Early_Pudding6221,Lovin these two together! Another friend for Everglade Green! 💚😊,Align leggings in everglade green X Energy bra in Glitch Tapestry Starlight Multi,652,20,Fit Pics,https://www.reddit.com/r/lululemon/comments/1gezm9s/lovin_these_two_together_another_friend_for/,,,
1gevz5o,2024-10-29 14:28:46+00:00,jlt091,Dramatic Magenta 💜,"Lightened the photo to show the true color, it looks black in photos for some reason 25 inch Wunder Unders in Everlux (4) Smooth Cover Strappy Bra in Small I know this bra is controversial but I absolutely love it!! Stayed put while weightlifting",803,31,Fit Pics,https://www.reddit.com/r/lululemon/comments/1gevz5o/dramatic_magenta/,,,
1gevtqa,2024-10-29 14:22:24+00:00,AffectionateShift9,What the actual f* are these prices,"I love wasting money, it’s a special skill of mine but this is insaneeeee pricing.",842,261,New Online Drop or Markdown,https://www.reddit.com/r/lululemon/comments/1gevtqa/what_the_actual_f_are_these_prices/,,,
1ge8nan,2024-10-28 18:00:09+00:00,Early_Pudding6221,I do wear black sometimes 🖤🩵,Black align leggings X Black cropped define jacket X Kayak Blue align tank :),1817,44,Fit Pics,https://www.reddit.com/r/lululemon/comments/1ge8nan/i_do_wear_black_sometimes/,,,
1gdbeoh,2024-10-27 13:51:21+00:00,starskynight,Sometimes all you need is a splash of color 🎨,,1118,28,Fit Pics,https://www.reddit.com/r/lululemon/comments/1gdbeoh/sometimes_all_you_need_is_a_splash_of_color/,,,
1gcrilq,2024-10-26 18:26:44+00:00,Then_Manager6501,Nightfall and vita pink combination💜💕,nightfall aligns with pockets/ vita pink align bra,1511,21,Fit Pics,https://www.reddit.com/r/lululemon/comments/1gcrilq/nightfall_and_vita_pink_combination/,,,
1gcmxbc,2024-10-26 14:58:03+00:00,Early-Technology822,Graphite Gray,"Graphite gray Wunder Trains (woven?) and Flow Y. Size 6 both. These leggings polarize people, but I like them!",1472,52,Fit Pics,https://www.reddit.com/r/lululemon/comments/1gcmxbc/graphite_gray/,,,
1gc3s0i,2024-10-25 20:22:18+00:00,ezbreesie,Taking advantage of the sunlight ☀️,Flow Y strappy bra (4) + Wunder Train (6) in black It bugs me just a tinyyyy bit that the colors don’t fully match 🥲,558,5,Fit Pics,https://www.reddit.com/r/lululemon/comments/1gc3s0i/taking_advantage_of_the_sunlight/,,,
1gc2r6g,2024-10-25 19:38:08+00:00,Early_Pudding6221,These are my two favorite lulu colors of all time 🩵💜,Dark lavender align tank X tidal teal align leggings ! I neeeeed a tidal teal align tank it’s my dream right now 💘,2280,79,Fit Pics,https://www.reddit.com/r/lululemon/comments/1gc2r6g/these_are_my_two_favorite_lulu_colors_of_all_time/,,,
1gbwgcl,2024-10-25 15:06:34+00:00,Gullible_Grocery6142,Here are some of my fits as an educator :),"pic 1 - Mojave tan Steady State + Wundermost tank, Tauptatsitc Low rise Align Flare leggings + Crewneck shrug pic 2 - Sheer Blue Define Jacket, Sinatra Blue Wundermost Tank, generic green leggings (similar to Palm Court) pic 3 - Sheer Blue Define Jacket, Light Heather Grey Skims dress pic 4 - True Navy Oversized Pullover, Larkspur Dance Studio Cargo Panda pic 5 - Kayak Blue Oversized Full Zip Scuba, Sinatra Blue Wundermost Tank, Black V-Waist Mini Flare Leggings, Ice Blue Ugg Tazz",513,46,Fit Pics,https://www.reddit.com/r/lululemon/comments/1gbwgcl/here_are_some_of_my_fits_as_an_educator/,,,
1gbdmqc,2024-10-24 21:16:09+00:00,,Altering my scubas 💫,"I edit the bottom hem of my scubas by cutting a slit on the inside and feeding a wide sturdy elastic through the bottom to cinch up the waste just slightly looser than my real waist. Personally, I do this because I just really dislike the fit of scubas! It’s how they flare out at the bottom hem, how the hood is trying to drag me down to hell, how poorly they wash and end up looking cheap, how the sleeves are somehow too short and too long all at the same time!? So this alteration literally fixes all my issues with them and I just love the look of it with leggings so much more 🥰 bonus pics of my fall layering 🍂🍁🍃aligns size 4 - longline flow y size 4 - scuba half zip hoodie size L - cropped wunderpuff vest size 6",455,41,Hemming/Alterations/Dye,https://www.reddit.com/r/lululemon/comments/1gbdmqc/altering_my_scubas/,,,
1gbd1x4,2024-10-24 20:51:03+00:00,Historical_Piglet_41,Bought a cropped define jacket yesterday. I feel like a sexy spy lol,Ignore the setting I’m at work ☺️,560,30,Fit Pics,https://www.reddit.com/r/lululemon/comments/1gbd1x4/bought_a_cropped_define_jacket_yesterday_i_feel/,,,
1gb9ofc,2024-10-24 18:28:43+00:00,,so excited to pair this with a big cardigan and leg warmers! 🍂,Align Bodysuit Black - Sz 4 - 5’3 120ish lbs,569,55,In-Store Find,https://www.reddit.com/r/lululemon/comments/1gb9ofc/so_excited_to_pair_this_with_a_big_cardigan_and/,,,
1gb64zh,2024-10-24 16:01:02+00:00,Early_Pudding6221,"I know you guys love bunbun but some of you wanted to know what’s behind me and well, here he is - Sherriff Hopper🐸❤️🩶",Red align tank X Heathered grey older style wunder unders X big ol bullfrog,736,76,Fit Pics,https://www.reddit.com/r/lululemon/comments/1gb64zh/i_know_you_guys_love_bunbun_but_some_of_you/,,,
1gb2uge,2024-10-24 13:38:45+00:00,starskynight,🩵💙,,632,13,Fit Pics,https://www.reddit.com/r/lululemon/comments/1gb2uge/_/,,,
1gb06l7,2024-10-24 11:19:45+00:00,ellariex,Love how it fits me even if im petite! (149 cm),"Im wearing the align tank size 2, and the wunder train leggings size 2",494,13,Fit Pics,https://www.reddit.com/r/lululemon/comments/1gb06l7/love_how_it_fits_me_even_if_im_petite_149_cm/,,,
1g9r1je,2024-10-22 19:40:49+00:00,Early_Pudding6221,It snowed where I live so I’m bringing back spring with sunny coral 🪸😭💛,Align leggings in sunny coral 🪸,1557,47,Fit Pics,https://www.reddit.com/r/lululemon/comments/1g9r1je/it_snowed_where_i_live_so_im_bringing_back_spring/,,,
1g9iawh,2024-10-22 13:36:06+00:00,starskynight,Matching colors 🌲,,501,12,Fit Pics,https://www.reddit.com/r/lululemon/comments/1g9iawh/matching_colors/,,,
1g96aom,2024-10-22 01:17:09+00:00,,Back In Black,Wearing the wunder train mesh panel tank size 6 and the align skirt size 6 🖤,744,20,Fit Pics,https://www.reddit.com/r/lululemon/comments/1g96aom/back_in_black/,,,
1g8ubx3,2024-10-21 16:44:48+00:00,__kay_jay__,60 days in: Swiftly edition (final thoughts),"To preface: over the last 2 months I worked on a farm in this shirt and washed it everyday in hot water with no real regard for it's well-being. Bought this secondhand Swiftly SS (10) in Electric Turquoise NWT for $10 so this experiment overall has been relatively low cost entertainment for me. I'm tapping out at this point guys. In my last post, I agreed to 90 days but it's decline makes it unbearable to wear at this point. Not to sound dramatic or anything 😂 The neck has stretched out significantly, and is now bothersome to me day to day. Functionally, it does not smell and did not rip any seams or threads. The color hasn't faded nor has it been bleached in any areas. It hasn't retained any stains either, which I found impressive. The hole you see I gained on day 33, and that was cut by tin siding. To be fair, I can't expect a piece of fabric to win in that situation. That hole has not gotten any bigger through the last month, nor has it started unraveling. Pic 1: fresh washed close up Pic 2 & 3: Day 33, aka the day the tin caught my shirt but not my skin Pic 4: highlights the stretching I'm referring to I don't know what else I could do to this shirt, but it really has held up very well. I didn't even expect it to hit the 30 day mark and if it wasn't for me not liking the neckline, I could continue to wear this shirt and it still is a really good shirt. Swiftlies are a great material, and are more durable than I wanted to give them credit for. Looking forward to wearing fall colors now 😅",701,42,Review,https://www.reddit.com/r/lululemon/comments/1g8ubx3/60_days_in_swiftly_edition_final_thoughts/,,,
1g8h4uj,2024-10-21 04:02:11+00:00,Busy_Basil9638,Sooo stunning 🤩 twilight rose w/ rose gold define jacket 🤩🤩,,546,37,Fit Pics,https://www.reddit.com/r/lululemon/comments/1g8h4uj/sooo_stunning_twilight_rose_w_rose_gold_define/,,,
1g85272,2024-10-20 18:12:50+00:00,Early_Pudding6221,This was a favourite that I used to wear before even posting my fits 💟 ft. BUNBUN🐰,"Dark lavender align leggings, white asymmetrical bra, lilac smoke cropped scuba 💜🤍",1109,44,Fit Pics,https://www.reddit.com/r/lululemon/comments/1g85272/this_was_a_favourite_that_i_used_to_wear_before/,,,
1g7mycd,2024-10-20 00:39:46+00:00,Early_Pudding6221,Deep luxe and strawberry milkshake 🫱🏼‍🫲🏻🍓,Strawberry milkshake align tank X deep luxe SmoothCover,1402,24,Fit Pics,https://www.reddit.com/r/lululemon/comments/1g7mycd/deep_luxe_and_strawberry_milkshake/,,,
1g7d447,2024-10-19 16:48:17+00:00,Icy_PrincessBeanPink,Twilight rose rose gold define jacket 😍,I found this in store yesterday and have been seeing other people find it in this sub as well this jacket is beautiful and the rose gold goes so well with it. I did not get it at least yet sadly I’ve been trying to save some money and try to only stick to WMTM but just WOW love love love this jacket I’m wearing a size 2 and the pictures are pretty accurate for the colour for in person,469,59,In-Store Find,https://www.reddit.com/r/lululemon/comments/1g7d447/twilight_rose_rose_gold_define_jacket/,,,
1g7bhlu,2024-10-19 15:33:53+00:00,starskynight,🍒 🍒🍒,,585,12,Fit Pics,https://www.reddit.com/r/lululemon/comments/1g7bhlu/_/,,,
1g6tfep,2024-10-18 21:39:42+00:00,steakandfruit,My favorite outfit ever,Lululemon Align cross back bodysuit 25” in black and size 2!!!,669,38,Fit Pics,https://www.reddit.com/r/lululemon/comments/1g6tfep/my_favorite_outfit_ever/,,,
1g6p19t,2024-10-18 18:24:10+00:00,Early_Pudding6221,Matched my crown 👑 🥰,Glaze pink align leggings X vivid plum align tank :),1464,30,Fit Pics,https://www.reddit.com/r/lululemon/comments/1g6p19t/matched_my_crown/,,,
1g6iaae,2024-10-18 13:39:02+00:00,,Expresso aligns 🤩,Absolutely love the way lulu does their browns every year. Sorry about the pink hue I have pink and yellow lights in my room but this is the align longline bra size 4 in expresso and the align shorts 6” in expresso :) My measurements are im 159cm tall and 32C-22-34.5 jeans 23-24,1546,38,Fit Pics,https://www.reddit.com/r/lululemon/comments/1g6iaae/expresso_aligns/,,,
1g5wtnv,2024-10-17 17:47:24+00:00,Early_Pudding6221,"New mirror, hair in a bun, bench out.. Uhh who is she?!😂",Seagram green align leggings and Guava pink align tank (very similar to Sakura pink),1656,30,Fit Pics,https://www.reddit.com/r/lululemon/comments/1g5wtnv/new_mirror_hair_in_a_bun_bench_out_uhh_who_is_she/,,,
1g59ya9,2024-10-16 20:59:03+00:00,jlt091,Garnet♥️,Ok Lulu I forgive you for giving us zero neons this summer because every fall color this year is amazing! The most beautiful red purple. (also matches the Uggs perfectly) 25 inch wundertrain (4) in Garnet Energy bra (6) in Garnet,1559,49,Fit Pics,https://www.reddit.com/r/lululemon/comments/1g59ya9/garnet/,,,
1g574dd,2024-10-16 18:58:05+00:00,Then_Manager6501,Blue nile! 💙🖤,Blue Nile aligns/ black align tank.,820,25,Fit Pics,https://www.reddit.com/r/lululemon/comments/1g574dd/blue_nile/,,,
1g44ynv,2024-10-15 11:00:05+00:00,imma_ninjaaa,Happy BLUESday!💙💪🏻,In my favorite place wearing my favorite color! Quick workout today inspired by my leopard 🐆 camo blue align top and ?hero blue align pants 25” (both size 4),550,36,Fit Pics,https://www.reddit.com/r/lululemon/comments/1g44ynv/happy_bluesday/,,,
1g3jqma,2024-10-14 16:18:50+00:00,Early_Pudding6221,Happy Thanksgiving to my fellow Canadians 💚,Mint moment align tank X Everglade green align leggings,1540,29,Fit Pics,https://www.reddit.com/r/lululemon/comments/1g3jqma/happy_thanksgiving_to_my_fellow_canadians/,,,
1g2y7hs,2024-10-13 19:52:27+00:00,Early_Pudding6221,Someone said Grey and Red!🩶❤️,Rhino grey asymmetrical bra X Dark red Align leggings,1641,63,Fit Pics,https://www.reddit.com/r/lululemon/comments/1g2y7hs/someone_said_grey_and_red/,,,
1g2w4sd,2024-10-13 18:22:09+00:00,Party-Belt-3624,"Beautiful Lululemon store, San Francisco",,554,20,Discussion,https://www.reddit.com/r/lululemon/comments/1g2w4sd/beautiful_lululemon_store_san_francisco/,,,
1g200be,2024-10-12 13:22:00+00:00,Shoppingaddictxo,Always Effortless jacket in Slate Brown,"Honestly, I was never interested in these jackets till I saw one on a mannequin and it looked so good! It’s a perfect windbreaker. Comes with a hood you can tuck away for light rain. Posted in two different lighting for color reference 💞",515,45,Fit Pics,https://www.reddit.com/r/lululemon/comments/1g200be/always_effortless_jacket_in_slate_brown/,,,
1g1cp8a,2024-10-11 15:38:24+00:00,Neonatalnerd,🍓 milkshake day,Align tank (6) and skirt (6) in strawberry milkshake! Post workout athleisure fit to grab some boba tea with the kiddo.,1599,31,Fit Pics,https://www.reddit.com/r/lululemon/comments/1g1cp8a/milkshake_day/,,,
1g0yo6g,2024-10-11 01:34:47+00:00,Illustrious-Bed2578,Flush pink 🩷,Flowy nulu bra in flush pink align leggings in flush pink this was my first lulu set it’s special 🫶,863,11,Fit Pics,https://www.reddit.com/r/lululemon/comments/1g0yo6g/flush_pink/,,,
1g0tr6r,2024-10-10 21:29:24+00:00,Early_Pudding6221,I love blue and green 😇,Mint moment align tank X blue mile align leggings !,599,18,Fit Pics,https://www.reddit.com/r/lululemon/comments/1g0tr6r/i_love_blue_and_green/,,,
1g0sxl3,2024-10-10 20:53:24+00:00,Inevitable_Praline33,Rose blush,"Align 23 & align v neck bra, not a fan of the double lined but the color was too cute to pass up 🥲",2100,75,Fit Pics,https://www.reddit.com/r/lululemon/comments/1g0sxl3/rose_blush/,,,
1g013w9,2024-10-09 20:20:57+00:00,krista_weiss,new pickups,soft jersey straight leg MR pant (regular) -heathered dark espresso size 2 got this on sale for 69 . online its full price 🤫 wunder train strappy racer bra C/D black size 8,1107,31,Fit Pics,https://www.reddit.com/r/lululemon/comments/1g013w9/new_pickups/,,,
1fz7m60,2024-10-08 18:58:57+00:00,Illustrious-Bed2578,Gym fit,Lilac smoke align leggings with pockets sz 4 💜 Hooded define jacket in magneta glow sz 0 💗 I want more lulu colors that are warm spring or warm autumn,653,25,Fit Pics,https://www.reddit.com/r/lululemon/comments/1fz7m60/gym_fit/,,,
1fz4xc5,2024-10-08 17:06:50+00:00,jlt091,Nulu Strappy Bra,Nulu Strappy V-Neck Yoga Bra (6) in White,916,28,Fit Pics,https://www.reddit.com/r/lululemon/comments/1fz4xc5/nulu_strappy_bra/,,,
1fym904,2024-10-07 23:45:46+00:00,usb_donglegoblin,Color comparison no one asked for - fall maroons edition,"My new Garnet aligns arrived in the mail today so figured I’d do a color comparison for anyone interested. As you can see, I’m a jewel tone girlie all the way. I was hoping Garnet would be a close match for my beloved Cassis aligns, which are 7 years old and have a hole in them 😭 Cassis, alas, leans more purple (which I love) but Garnet is still super pretty. Top row: Align 28” in Cassis, In Movement 2.5” short in Dark Adobe, Align 23” in Garnet, Energy Bra longline in Red Merlot Bottom Row: In Movement tight 28” in Deep Rouge, Wunder Train 25” in Deep Luxe, Align 23” in Pomegranate",659,49,Color or Size Comparison,https://www.reddit.com/r/lululemon/comments/1fym904/color_comparison_no_one_asked_for_fall_maroons/,,,
1fye2u3,2024-10-07 17:58:29+00:00,Then_Manager6501,Garnet/ black 🖤,Black align bra and garnet aligns :),1122,17,Fit Pics,https://www.reddit.com/r/lululemon/comments/1fye2u3/garnet_black/,,,
1fy7m6t,2024-10-07 13:28:16+00:00,Logical_Zebra7981,Storm Teal is my new fav,Define jacket size 6 Wunder Trains size size 6,474,8,Fit Pics,https://www.reddit.com/r/lululemon/comments/1fy7m6t/storm_teal_is_my_new_fav/,,,
1fxqx6f,2024-10-06 21:06:49+00:00,,OOTD 💜,Envital bra in lilac size 8 (regret sizing up in this one) Align skirt in true navy size 4 Not my fav lulu outfit but great for pickleball!,611,33,Fit Pics,https://www.reddit.com/r/lululemon/comments/1fxqx6f/ootd/,,,
1fxg45i,2024-10-06 13:09:05+00:00,Early-Technology822,Yoga Fit,1. Ribbed wild indigo Align size 4. Blue chambray Align bra size 6. 2. Same but with pink porcelain Better Best long sleeve size 6 (I think),535,28,Fit Pics,https://www.reddit.com/r/lululemon/comments/1fxg45i/yoga_fit/,,,
1fxexv5,2024-10-06 12:04:16+00:00,toastedteddy_,Favourite blue from Lulu 🩵,Align 6” (4) and Wunder Train Sports Bra (6),896,20,Fit Pics,https://www.reddit.com/r/lululemon/comments/1fxexv5/favourite_blue_from_lulu/,,,
1fwxkpa,2024-10-05 18:58:18+00:00,Early_Pudding6221,Matching my Lulu bands ☺️🩷,Sakura pink align tank X vintage rose align leggings :),551,13,Fit Pics,https://www.reddit.com/r/lululemon/comments/1fwxkpa/matching_my_lulu_bands/,,,
1fw9u12,2024-10-04 21:06:28+00:00,Early_Pudding6221,I don’t see enough seawheeze on here!,Icing blue align leggings and seawheeze 20 super sonic alpine white multi high neck energy bra,574,24,Fit Pics,https://www.reddit.com/r/lululemon/comments/1fw9u12/i_dont_see_enough_seawheeze_on_here/,,,
1fvbox6,2024-10-03 16:24:10+00:00,Early_Pudding6221,Bunbun and I say you can still have bright colors and be fall themed! 🎃💜🖤,"Dark lavender align tank, black cropped scuba , orange soda align leggings",733,42,Fit Pics,https://www.reddit.com/r/lululemon/comments/1fvbox6/bunbun_and_i_say_you_can_still_have_bright_colors/,,,
1fv7hym,2024-10-03 13:16:26+00:00,jlt091,Jade Grey 🤝 Legacy Green,Soft Foam Cup Asymmetrical Bra (XS) in Jade Grey 23 inch wundertrain (6) in Legacy Green,813,19,Fit Pics,https://www.reddit.com/r/lululemon/comments/1fv7hym/jade_grey_legacy_green/,,,
1fusg45,2024-10-02 22:05:21+00:00,Early_Pudding6221,Incoming fall fits 🍂🍃,Everglade green align tank X wunder under smooth cover in black :),580,14,Fit Pics,https://www.reddit.com/r/lululemon/comments/1fusg45/incoming_fall_fits/,,,
