post_id,timestamp,author,title,text,score,num_comments,link_flair_text,permalink,stickied,locked,upvote_ratio
1mte1hf,2025-08-18 06:10:18+00:00,pinkgrapefruitx,Why does Lululemon use Polyester?,I bought a new jumper just to find it is made of polyster? i love Lululemon and have always felt that they have really great quality clothes that last but i just don't understand the use of polyester even if it is recycled? Can someone explain this?,0,3,Discussion,https://www.reddit.com/r/lululemon/comments/1mte1hf/why_does_lululemon_use_polyester/,False,False,0.35
1mtdlgl,2025-08-18 05:44:16+00:00,painthrowaway852,Everglade Green/Gold Define - Size 2 - $109,https://shop.lululemon.com/p/jackets-and-hoodies-jackets/Define-Jacket-Nulu-MD/_/prod11210211,23,14,USA Restock,https://www.reddit.com/r/lululemon/comments/1mtdlgl/everglade_greengold_define_size_2_109/,False,False,0.85
1mtcl1u,2025-08-18 04:45:59+00:00,Brief-Excuse5089,Dark red finally + fit,"Super thrilled my parcel forwarding order finally arrived from the US. Seems Australia is skipped for the dark red drop 😢 it was an expensive way to do it but I’m happy to have gotten my hands on some of this colour, just sad it wasn’t the cropped define. This gives me serious bay watch vibes and I can’t wait to bring it out when the weather warms up ☀️🤣 🏄‍♀️ dark red align shirts size 2 + white ribbed define cropped 6 🏄‍♀️ Dark red align shorts + XS scuba + Todays outfit: My fave wild indigo Wunder trains + cropped ribbed define in Serene Blue (in size 4 - I sized down after my asking for advice post and happy with the fit) + white align tank + solar grey like a cloud bra ☺️",169,3,Fit Pics,https://www.reddit.com/r/lululemon/comments/1mtcl1u/dark_red_finally_fit/,False,False,0.99
1mt9i95,2025-08-18 02:10:33+00:00,painthrowaway852,New items - Rockwood & more,"Found on the CN site: 1) Smooth and Ribbed Nulu Women's Scoop Neck Sport Tee LW3IWZS Rockwood 2) Women's Side-Pleat High-Waist Tennis Skirt *Regular Fit LW8AQTS Rockwood 3) Women's Scuba Oversized Full-Zip Hoodie LW3HTLS-2 Blissful Pink 4) Women's Jersey Training Classic Fit Jersey Short Sleeve T-Shirt *Text Logo LW3JFWS-3 Red Clay 5) Women's Cotton-Blend Pleated Shorts 4"" Lined LW7DRXS Light Ivory 6) Throwback Still Women's Track Pants LW5FX9A-2 Warm Ash Grey 7) Pull-On Women's Elastic Waist Mid-Rise Wide-Leg Pants 28"" LW5IB9A Goodnight Plum 8) Groove Nulu™ Women's Mid-Rise Flare Pants Twist Waist LW5GYWA Black 9) New Crew Backpack LU9CLES-3 Rockwood 10) Find Your Balance Grip Socks *Strap LU9CJ9S-1 Rockwood 11) Water Bottle Crossbody Bag with Front Pocket LU9CBXS-1 Rockwood 12) Daily Essential Socks LU9CLAS-1 Rockwood/White",96,10,New Online Drop or Markdown,https://www.reddit.com/r/lululemon/comments/1mt9i95/new_items_rockwood_more/,False,False,0.99
1mt7lk5,2025-08-18 00:40:50+00:00,JournalistOk702,Are these shoes old or new?,I noticed these shoes in the scuba waffle pics but can’t find them on the site. Anyone know if these are legacy? or perhaps something unreleased?,18,23,Product Question/Recommendation,https://www.reddit.com/r/lululemon/comments/1mt7lk5/are_these_shoes_old_or_new/,False,False,0.87
1mt6rmj,2025-08-18 00:01:50+00:00,jlt091,Waffle Scuba Set,I never thought I would love this so much!! The pants are unfortunately too long for me 😭 I’m 5’2. But anyone who misses the cropped full zip scuba this is the closest I’ve loved since!! Scuba mid rise wide leg pant waffle in warm ash grey size XS Scuba cropped funnel neck half zip waffle in warm ash grey size small,176,19,Fit Pics,https://www.reddit.com/r/lululemon/comments/1mt6rmj/waffle_scuba_set/,False,False,0.97
1mt6p3t,2025-08-17 23:58:49+00:00,prettylittletingg,"hi, I’m back 👋🏼🍒","it’s been a minute and I’m so happy to be back with my Lulu fits 🥹🫶🏻 I was in Portugal for the last 9 days with my boyfriend - and it was absolutely magical. We spent 5 days in Lisbon, and 4 in Porto. I’m extremely jet lagged today (& the flight was a rough one home) but I am still powering through today for my boyfriend’s birthday. I am feeling extreme post trip depression - like bad, lol. I’m already planning the next Euro trip for 2026 (I’ve even considered end of 2025…) & already have my next trip to Canada planned, so I’m keeping myself busy with that lol. BONE BONE BONE 🤩 throw me *all* the bones, I love this staple. now - tonight let’s pray I don’t spend an arm and a leg since I haven’t taken a peek at the new WMTM items from last week/week before or any of the newer drops. missed my lulu fam 🥹🩷 🤍 all it takes ribbed nulu shirt: bone, size 4 🤍 align 6’ shorts: bone, size 4 🩷 scuba full zip cropped jacket: twilight rose, xs/s",261,23,Fit Pics,https://www.reddit.com/r/lululemon/comments/1mt6p3t/hi_im_back/,False,False,0.95
1mt416g,2025-08-17 22:02:29+00:00,hadurk,espresso x green twill,,153,4,Fit Pics,https://www.reddit.com/r/lululemon/comments/1mt416g/espresso_x_green_twill/,False,False,0.99
1mt40vh,2025-08-17 22:02:08+00:00,actualgoddessbb,Blue Twill,Blue twilllll I actually am so obsessed! Took these outside so you could get a true idea of the color if you are thinking about ordering Define size 4 Grooves size 4 squat tested!!!,180,17,Fit Pics,https://www.reddit.com/r/lululemon/comments/1mt40vh/blue_twill/,False,False,0.98
1mt3n5a,2025-08-17 21:46:53+00:00,navigationallyaided,"I’m matching in College Purple… and mixing it up again, thanks to lulujunkie.","College Purple Align 6” and Swiftly Racerback race-length, both in 8, with a cameo appearance from WT 6” in Tropics Tone, also in 8. Thanks to u/lulujunkie, the two look good together. I went diving in California’s Central Coast yesterday and Monterey Car Week screwed up traffic. I took a break at the Gilroy Outlets and scored the Align shorts for $30. But they were all out of tops - I did snap a Zeroed In men’s shirt but that will be for hanging out or climbing. Turned out one of the local stores had a Swifty tank top in stock, ordered it and went to the store to pick up/try on. I almost impulse bought a Blue Twill Align Racerback but I’m happy I didn’t. So now, I have another matching outfit and I can mix it up with my existing pieces as well. I think my Petrol Purple WT 25” will be a nice tonal pairing as well.",4,2,Fit Pics,https://www.reddit.com/r/lululemon/comments/1mt3n5a/im_matching_in_college_purple_and_mixing_it_up/,False,False,0.54
1mt2zr5,2025-08-17 21:20:33+00:00,SharplySweet,Lavender Frost Shorts,Hi everyone! Wondering if anyone knows if the Lavender Frost Pace Rival High Rise Shorts in 3 inches is see through? I tried on the white in store and it was pretty see through and I’m concerned the lavender frost is also too light.,4,5,Product Question/Recommendation,https://www.reddit.com/r/lululemon/comments/1mt2zr5/lavender_frost_shorts/,False,False,0.83
1mt2x94,2025-08-17 21:17:44+00:00,chikoritaaaaaaa,Any solutions for this? Seam of new Aligns snagged on velcro :(,"I accidentally snagged one of the seams of my Aligns against velcro on my gym bag. This is my first time wearing them and I'm so sad about it :( Is there any way to fix this without the threads ripping? I know Lululemon does hemming, but do they do repairs as well?",9,9,Hemming/Alterations/Dye,https://www.reddit.com/r/lululemon/comments/1mt2x94/any_solutions_for_this_seam_of_new_aligns_snagged/,False,False,0.77
1mt0xgb,2025-08-17 19:59:06+00:00,TealMiche,OOTD,"Cates Tee in black, A New Route skirt in Cassis and Power Strike Crew Socks in Lavender Lux",21,1,Fit Pics,https://www.reddit.com/r/lululemon/comments/1mt0xgb/ootd/,False,False,0.96
1mt04s3,2025-08-17 19:27:57+00:00,rangeroser,(Sweat drenched) Blue twill focuser bra & black nulu shorts 4” for today’s yoga class,I will always revert back to Lululemon for functional workout pieces 🫡,41,1,Fit Pics,https://www.reddit.com/r/lululemon/comments/1mt04s3/sweat_drenched_blue_twill_focuser_bra_black_nulu/,False,False,0.98
1msymi6,2025-08-17 18:30:54+00:00,Own_Ordinary_6877,Lavender Lux and Bone 💟,Lavender Lux is one of the colors that I rarely reach for but love how it meshed with Bone! Align Twist Back Tank - Lavender Lux Align High Rise Short 6” - Bone,150,6,Fit Pics,https://www.reddit.com/r/lululemon/comments/1msymi6/lavender_lux_and_bone/,False,False,0.96
1msxokr,2025-08-17 17:55:10+00:00,Elegant_Trouble_474,"F&F “Special Edition” - Second Run, Different Color","F&F “Special Edition” (Bay Leaf) and Swiftly Tech Short Sleeve (Washed Blue). Picked up a second set of these tights in a second color after running in these last week; I’m really liking this particular version of the F&F. Really light and cool, especially in these warmer months. Like the nightmoth, even though these are tagged as 25” in length, they definitely are not. These are more closer to and are more/less 28” in length. I’m also liking the paneling on the back of the legs too - as both a stylistic design and as a functional element. This really is a nice variation of the F&F. Hopefully it’ll either become a main variation of the F&F or a few more colors are released before they are retired, discontinued, or whatever. Something like a darker green or an espresso would be fantastic.",1,4,Review,https://www.reddit.com/r/lululemon/comments/1msxokr/ff_special_edition_second_run_different_color/,False,False,0.51
1mswo7c,2025-08-17 17:17:04+00:00,Admirable-Grass-109,OOTD 💖,sonic pink invigorate tank size 10 maize shorts size 10 6 in.,119,8,Fit Pics,https://www.reddit.com/r/lululemon/comments/1mswo7c/ootd/,False,False,0.98
1msu9z2,2025-08-17 15:44:15+00:00,Allllllexissssss,Kohlrabi Green fittttt 💚💚,,87,11,Fit Pics,https://www.reddit.com/r/lululemon/comments/1msu9z2/kohlrabi_green_fittttt/,False,False,0.95
1msu1fq,2025-08-17 15:34:56+00:00,Accomplished-Sky5681,Outlet pricing?,"I’m taking a 2 night trip soon, that will go near an outlet that has a Lulu store. Question is, are outlet prices worth taking time out of a short trip? I’d love to grab some savings, but not if the prices are generally about the same.",12,22,Sales and Discounts,https://www.reddit.com/r/lululemon/comments/1msu1fq/outlet_pricing/,False,False,0.84
1msti0b,2025-08-17 15:13:47+00:00,starskynight,Sunday Blues 💙,,100,4,Fit Pics,https://www.reddit.com/r/lululemon/comments/1msti0b/sunday_blues/,False,False,0.94
1msslv9,2025-08-17 14:38:28+00:00,Hairy-Economist683,water drop x lilac ether 🩵💜,This is the blue that started my obsession with all lulu blues. You know they’re old when the WTs have the lulu logo on the back of the waistband instead of behind the left leg!! Wunder Train 25” in Waterdrop (4) Envital Bra in Lilac Ether (4),96,14,Fit Pics,https://www.reddit.com/r/lululemon/comments/1msslv9/water_drop_x_lilac_ether/,False,False,0.99
1msrxb0,2025-08-17 14:10:50+00:00,runandplay2,Sakura Pink Appreciation 🌸,"Sometimes , I forget how good this color is. Petition for Lululemon to bring it back🤞😇 I pulled it out a few weeks ago to pair with washed blue and it’s been on rotation since. Sakura Pink Cropped Short Sleeve Swiftly (6) Blue Twill WT leggings 25in (4) Lilac Breeze WT shorts 6in (4) Washed Blue WT leggings 25in (4) White Fast and Free Split hem shorts 3.5in (xs)",147,17,Fit Pics,https://www.reddit.com/r/lululemon/comments/1msrxb0/sakura_pink_appreciation/,False,False,0.97
1msprxx,2025-08-17 12:36:26+00:00,Adventurous-Tax-4912,13L Slouchy Sling-difference in light ivory & light ivory silver(hint:SAME),"I have a black 13L Slouchy Sling bag and LOVE it, especially for travel. It has been the perfect bag for me so I decided to go for one in Ivory. The website shows 2 ivory bags, one is “light ivory” and the other “light ivory/silver”. Naturally, I was trying to determine the difference and the photos looked pretty much the same…so I chatted with an agent and was assured that the bags were different, the following is a quote from the chat: “These colour differences are very hard to see in the photos as they are not represented well based off light. From what we know this bag to be, the Light Ivory has a ""rose gold"" hard wear and the Light Ivory/Silver has Silver hard wear.” I explained that this clearly isn’t going to be accurate so I ordered both just to see…..Well, the bags are literally exactly the same color outside, the same color inside, the same fabric, the same internal pockets, the same zipper pulls….the SAME….the ONE and only difference is the closure of the large outside pocket on the bag; one has a snap that you can kind of see on the body of the bag and the other “light ivory/silver” has the snap on the INSIDE of the pocket. WOW…..literally that is it. So, if anyone else is wondering which “light ivory” slouchy sling bag to buy, it is all about a snap. I am keeping the “light ivory/silver” because I can attach a carabiner clip to the webbing that the snap is attached to.",23,5,Color or Size Comparison,https://www.reddit.com/r/lululemon/comments/1msprxx/13l_slouchy_slingdifference_in_light_ivory_light/,False,False,0.9
1mspcpn,2025-08-17 12:15:46+00:00,Adventurous_Phone206,Fast and free matching sets,Educators got another chance to purchase certain product at a heavy discount and I did my in store purchase yesterday. Fast and free leggings and matching bra in night moth And fast and free 8” shorts and matching tank in Bay Leaf Both are apart of the light collection that just launched.,48,12,Haul,https://www.reddit.com/r/lululemon/comments/1mspcpn/fast_and_free_matching_sets/,False,False,0.96
1msmgde,2025-08-17 09:28:28+00:00,unpopularopinionmale,Good bottoms for cold weather?,"Guy here, I’m going to Pikes Peak and want some warm under layer. Mainly for my legs. I was thinking of a pair of leggings and then wearing jeans over them. I don’t mind things made for men or women. Currently the weather at the summit there could be anywhere from 30-50°F. With it being in the 70°F+ down at the base. I already have a few leggings (size 2) and typically wear a size 28 or 29 waist in jeans from men and a size two in women’s jeans from American Eagle. Main reason I prefer women’s is it’s easier to find something that fits me. I am on the shorter and lighter side 5’2” (157cm) and 125lbs (56.5kg). I’m fine with lululemon or some other brands, that I can get in a couple of days, so better off in store. I am in the Madison/Milwaukee area, and can also make it to the Chicago suburbs if needed.",4,6,Product Question/Recommendation,https://www.reddit.com/r/lululemon/comments/1msmgde/good_bottoms_for_cold_weather/,False,False,0.65
1msm6ol,2025-08-17 09:10:58+00:00,Bettygirl78,Wunder Train HR 25” (8) Hidden Heritage Lace Black Multi,Love this pattern!,32,6,Fit Pics,https://www.reddit.com/r/lululemon/comments/1msm6ol/wunder_train_hr_25_8_hidden_heritage_lace_black/,False,False,0.88
1msm0x4,2025-08-17 09:00:47+00:00,lululemonmods,Sunday Rave Thread,Finally found a restock on something you’ve been waiting for? Had an awesome experience in store? Tried out a new piece and you’re loving it? Let’s hear it! This is the place for all the good things! Looking to vent instead? Check out Saturday’s rant thread.,2,6,Discussion,https://www.reddit.com/r/lululemon/comments/1msm0x4/sunday_rave_thread/,False,False,0.75
1msgq65,2025-08-17 03:48:54+00:00,SnowDiscombobulated4,Blue twill and Pink Frosting Aligns!,Lulu really ate with these 2 colours. I’m not a huge fan of brighter colours but I couldn’t resist. (Pink Frosting Align Tank/Blue Twill Align Shorts 4”). The Align leggings were just as beautiful but out of budget for today’s haul.,109,6,Fit Pics,https://www.reddit.com/r/lululemon/comments/1msgq65/blue_twill_and_pink_frosting_aligns/,False,False,0.95
1msgj1d,2025-08-17 03:38:15+00:00,Sweet_Sunshine7,Leopard Daisy Starlight Multi and Pink Haze 🐆💫💕,Thank you to runandplay2 for putting these wunder trains on my radar! And on mark down too! They’ve quickly become a pair I reach for weekly. Wish I had got the matching bra but that is not longer available. Swiftly Tech Long Sleeve Shirt 2.0 waist length and flow y bra Pink Haze Wunder Train High Rise Tight 25” Leopard Daisy Starlight Multi,133,13,Fit Pics,https://www.reddit.com/r/lululemon/comments/1msgj1d/leopard_daisy_starlight_multi_and_pink_haze/,False,False,0.99
1msex1y,2025-08-17 02:15:34+00:00,jacknicholscum,Gym + walk fit of the day 🤎🖤,Lightweight split-back training tank in Black size S Align HR shorts 6” in Truleopard MAX Brown Multi size 6 Scuba OS Half Zip Hoodie in Espresso size M/L Unisex Daily Essential Crew Socks in Sheer Oak I love the versatility of this top! It’s super lightweight and a great layering piece.,75,14,Fit Pics,https://www.reddit.com/r/lululemon/comments/1msex1y/gym_walk_fit_of_the_day/,False,False,0.97
1mse7au,2025-08-17 01:40:13+00:00,StrawberryCat1957,So lulu will make this but won’t bring back poolside…alriiiiggghhttt…,Saw this on a tik tok ad all I can say is what is going on at lulu hq 😭,73,16,Humor,https://www.reddit.com/r/lululemon/comments/1mse7au/so_lulu_will_make_this_but_wont_bring_back/,False,False,0.88
1msbqy8,2025-08-16 23:44:27+00:00,soopygoopy,OOTD,Energy Longline bra - raspberry coulis size 8 Swift speed HR - raspberry coulis size 8 Define jacket - blissful pink size 10,138,2,Fit Pics,https://www.reddit.com/r/lululemon/comments/1msbqy8/ootd/,False,False,0.97
1msa6si,2025-08-16 22:40:31+00:00,garden-guru,Pink tide vs Glaze pink confusion,"I recently ordered two softstreme crop sweatshirts from Lulu Like New - one was pink tide (a light pale pink) and the other was glaze pink (a bright vivid pink). The package just arrived and the shirts look identical. And there's no tag or identifying information on them. I'm assuming they sent me two of the same thing, but neither one really matches the online photos of what I ordered. Since softstreme colors often look more muted in person than online, I'm not really sure if I got two of the wrong things altogether or two of one of those colors that I actually ordered. Anyone have a color comparison you could share? Especially in softstreme?",1,2,Request,https://www.reddit.com/r/lululemon/comments/1msa6si/pink_tide_vs_glaze_pink_confusion/,False,False,0.6
1ms9jsb,2025-08-16 22:14:54+00:00,Channel-Adventurous,Beware - Scuba Cropped Funnel-Neck Half Zip Waffle,"Annoyed! For $150 I expected more :( I wore it out for less than 6 hours and noticed some snagging on the cuffs, just wore it out to brunch so not sure why! But it is very fragile.",126,60,Review,https://www.reddit.com/r/lululemon/comments/1ms9jsb/beware_scuba_cropped_funnelneck_half_zip_waffle/,False,False,0.91
1ms7hri,2025-08-16 20:56:17+00:00,QuietShoe33,Dance studio crop vs Dance studio full length,"A few months ago I was in store and tried one of each style on. One fit true to size, the other was snugger and I needed to size up and the store associate confirmed the fit difference in the moment as well. I can’t remember which one and I feel like a crazy person because customer service is saying “they fit the same aside from length”, I can’t get to the store right now otherwise I’d just go and try them again in person. Can anyone else speak to this? I can’t be imagining this discrepancy 🤯",6,3,Sizing Advice,https://www.reddit.com/r/lululemon/comments/1ms7hri/dance_studio_crop_vs_dance_studio_full_length/,False,False,0.8
1ms73v1,2025-08-16 20:41:42+00:00,lulujunkie,OOTD - Saturday fit with tropics tone and college purple,A bright outfit for an otherwise gloomy day. Tropics tone aligns paired with swirly tank in college purple and this morning my new men’s beyondfeel shoes in lilac breeze/ocean air/elixir came in! Best part about the shoes is that I actually fit them with my freakishly wide feet and they’re super comfy. I included a comparison to my beloved lilac ether shoes from last year. They’ve held up pretty good given the number of run miles I’ve put on them. They’re officially retired to everyday walking shoe duty now.,50,33,Fit Pics,https://www.reddit.com/r/lululemon/comments/1ms73v1/ootd_saturday_fit_with_tropics_tone_and_college/,False,False,0.77
1ms6she,2025-08-16 20:29:53+00:00,No_Particular_7981,Sea water in person?,Can anyone compare this color or show it in person? Thanks!,6,1,Request,https://www.reddit.com/r/lululemon/comments/1ms6she/sea_water_in_person/,False,False,0.81
1ms6qbl,2025-08-16 20:27:40+00:00,SugarT0ast,Disney & Vuori Comparison,"Hey Lulu Lovers! I have not worn Lulu before. Not because I was against it- I just was too big to feel comfortable in it for a while, and then I lost 84 pounds, but found Vuori and fell in love with them. Anyway. I love the Disney x Lulu leggings, and am thinking by of buying a pair, probably from Poshmark (so not returnable). I don’t know what size to get- I hear Lulu runs small? I wear a Medium in Vuori All The Feels (not much compression) and the Daily w/ Pockets (more compression). I wear mostly a 10/M in other pants, but can sometimes do an 8. The Disney leggings say they are Wunder Train, if that matters.",0,8,Sizing Advice,https://www.reddit.com/r/lululemon/comments/1ms6qbl/disney_vuori_comparison/,False,False,0.5
1ms5e9e,2025-08-16 19:38:03+00:00,Ok-Zebra-1747,Using mesh bags for Aligns and other leggings?,"Does anyone recommend using mesh bags to wash their Aligns and other Lulu leggings? Is it only necessary if you’re washing leggings together? None of my leggings have hardware or zippers. My mesh bags do have zippers but there’s a little panel to tuck them in so they’re not loose in the wash. I don’t know if the delicates/low spin cycle is enough to reduce stretching or tangling in the washing machine, or if adding a mesh bag will help with that. And if the zipper on the mesh bag is going to cause any issues. I do flip my leggings inside out when I wash.",2,20,Laundry,https://www.reddit.com/r/lululemon/comments/1ms5e9e/using_mesh_bags_for_aligns_and_other_leggings/,False,False,0.75
1ms59o2,2025-08-16 19:33:11+00:00,Withlove143,A WAFFLE SET: SCUBA OVERSIZED FULL ZIP W THE SCUBA MR WIDE LEG PANT ALL IN HEATHERED WARM ASH GREY 🤍,was skeptical on keeping this set as it’s pricyyy but i think i need to keep it. it’s gonna be a perfect travel set for some upcoming travels. 🤍,127,39,Fit Pics,https://www.reddit.com/r/lululemon/comments/1ms59o2/a_waffle_set_scuba_oversized_full_zip_w_the_scuba/,False,False,0.96
1ms595t,2025-08-16 19:32:39+00:00,Think-Dream624,Nightmoth Fit Check.,"Nulux Strappy-Back Sports Bra – Size Medium, Colour Nightmoth Wunder Train High-Rise Tight 25” – Size 6, Colour Nightmoth",67,10,Fit Pics,https://www.reddit.com/r/lululemon/comments/1ms595t/nightmoth_fit_check/,False,False,0.97
1ms45cv,2025-08-16 18:52:55+00:00,breadmonkey17,Waffle Scuba Full Zip,"Paired with a black align skirt I'm super picky when it comes to scubas. I have the traditional oversized scubas but they don't cover my lower back and I get cold and annoyed. I still wear them anyway, but they're not perfect. This waffle hoodie fixes that problem like you wouldn't believe. As a long torso girlie, it's hard to wear cropped things because the proportions are so off. But this hoodie makes up for all of it and will be great in the cooler transition months. So tempted to snag a grey one...",73,18,Fit Pics,https://www.reddit.com/r/lululemon/comments/1ms45cv/waffle_scuba_full_zip/,False,False,0.95
1ms3ye9,2025-08-16 18:45:52+00:00,autumnleaf212,Fell in love with Bay Leaf! 🤍,Swiftly Tech Long Sleeve in Bay Leaf size 2 Align High-Rise Skirt in Bay Leaf size 2,190,4,Fit Pics,https://www.reddit.com/r/lululemon/comments/1ms3ye9/fell_in_love_with_bay_leaf/,False,False,0.98
1ms3p2k,2025-08-16 18:36:37+00:00,Time-Sign-6660,Wunder Under front seam,"What is the curved front seam supposed to do? I understand how it can be accentuating in the back, but the front seems odd. I see posts where people say it is flattering in the front. How does it help (or hurt)? Thanks!",2,6,Product Question/Recommendation,https://www.reddit.com/r/lululemon/comments/1ms3p2k/wunder_under_front_seam/,False,False,0.62
1ms04wj,2025-08-16 16:28:47+00:00,Montrice8,Autumn Rust x Bone,"Autumn Rust Shake it out shorts (L) and EBB, Invigorate bra Aztec Brick (10), White Opal Define (8) Grey Essentials sock",114,23,Fit Pics,https://www.reddit.com/r/lululemon/comments/1ms04wj/autumn_rust_x_bone/,False,False,0.98
1mrz0xb,2025-08-16 15:49:10+00:00,Admirable-Grass-109,OOTD 🧈🍵,OBSESSED with this combo 😍🤌🏼 Softstreme Buttercream Half zip funnel neck size 8- can I just say this is seriously the softest material I have ever felt. I will be buying more of these 💯 Buttercream biker shorts size 10 4in. IdealMint high neck align tank size 10. This has to be my favorite combo yet. I think Buttercream will get paired with lavender frost next 🤩,207,14,Fit Pics,https://www.reddit.com/r/lululemon/comments/1mrz0xb/ootd/,False,False,0.97
1mryr35,2025-08-16 15:39:35+00:00,Longjumping_Goat_967,sonic pink x lavender frost x chilled grape,sonic pink luxtreme headband with lavender frost wunder train straps bra and chills grape shake it out shorts for a local 5k! I ended up placing 3rd overall female 💪🏃‍♀️💨,88,8,Fit Pics,https://www.reddit.com/r/lululemon/comments/1mryr35/sonic_pink_x_lavender_frost_x_chilled_grape/,False,False,0.98
1mryk21,2025-08-16 15:32:12+00:00,TealMiche,Airport Fit,Align long sleeved top and HR leggings with pockets in Diamond Dye Starlight Smoked Spruce,40,11,Fit Pics,https://www.reddit.com/r/lululemon/comments/1mryk21/airport_fit/,False,False,0.93
