post_id,timestamp,author,title,text,score,num_comments,link_flair_text,permalink,stickied,locked,upvote_ratio
1n7q2s8,2025-09-03 20:31:13+00:00,berry_pink,Price change in a few days and bad CSR,"I was shopping for a new skirt as a treat-yo-self and I saw the new Side-Pleat High-Rise Tennis Skirt. The red one priced at $98 but as it was a TYS purchase I decided to get it along with 3 other items. I got a notice that my item was shipped but awaiting carrier pick-up but that lasted so many days which is unusual for lulu. I contacted Lululemon to inquire and they said it was lost. They would refund me but seeing that the price has increased by then dollars for the skirt, I asked if they would just replace the order. The CSR said they need 100 items in order for a replacement to happen but it's available online. After some arm twisting, she put the order threw but told me that there was a good chance my order would get cancelled. I shop a lot at Lululemon and lately I feel like the customer service has been going way down. We pay a lot of money for the clothes and it just left a bad taste that I had to so much coaxing to get a reorder on a lost shipment because they use a bad carrier. Fingers crossed I actually get the celebratory skirt I ordered.",2,0,Discussion,https://www.reddit.com/r/lululemon/comments/1n7q2s8/price_change_in_a_few_days_and_bad_csr/,False,False,1.0
1n7po2x,2025-09-03 20:16:03+00:00,runandplay2,In Store Try On (Rockwood / New define Track that jacket / WT leopard) 🐆 🧨🫒,"Sorry for the double post today but thought others would want to see the try on. I was so curious to see rockwood in person. Seems very true to online. It is a gorgeous jewel tone. The new define track that jacket was actually so much better in person. I loved it. It feels like a mix between the define and scuba with how it feels and fits. My big issue with it is there are two zippers and the bottom zipper ends in a weird spot for me. So I passed but if you get it, I’d size down. I first tried a 4 and it was pretty big so switched to a 2. I was disappointed with the WT leopard print in person. It was so hard to see and the material felt stiff. I think the sequoia WTs are much prettier so I skipped the print. Rockwood Cropped Define (4) Rockwood Align 6in shorts (2) Paired with the bra I had on — Lavender Frost Focuser Scoop neck Olive Brown / Black Define Track that jacket (2) Leopard Shift Micro Embossed Brown WT leggings (2) Rockwood Scuba joggers (xxs) My top I wore in — All it takes Club blue twist back top",14,1,Fit Pics,https://www.reddit.com/r/lululemon/comments/1n7po2x/in_store_try_on_rockwood_new_define_track_that/,False,False,1.0
1n7nh4p,2025-09-03 18:53:26+00:00,Puzzleheaded-Fan5586,Which bag for travel?,Looking for a safe crossbody bag for a European trip I’m taking next month (Italy). Has anyone traveled with these? Did you like?!,2,2,Product Question/Recommendation,https://www.reddit.com/r/lululemon/comments/1n7nh4p/which_bag_for_travel/,False,False,0.75
1n7n9mb,2025-09-03 18:45:38+00:00,Ameeeekay,OOTD 🤍🖤,"Fast and Free High-Rise Classic-Fit Split Short 3"" (sm) and Align tank (8) and of course a belt bag 🤍🖤",29,1,Fit Pics,https://www.reddit.com/r/lululemon/comments/1n7n9mb/ootd/,False,False,0.89
1n7n4e1,2025-09-03 18:40:03+00:00,Apprehensive_Place51,insulated os collared jacket sizing,"could anyone give me sizing advice on this? i'm 5'1, 98lbs. i was thinking maybe xxs bc i dont want to look like a snowman",1,4,Sizing Advice,https://www.reddit.com/r/lululemon/comments/1n7n4e1/insulated_os_collared_jacket_sizing/,False,False,0.66
1n7myup,2025-09-03 18:34:15+00:00,SuperThickLongPickle,What are these marks on my water bottle?,I got this as a gift so I’m not too familiar with the quality of their water bottles. I haven’t used this bottle in a while and when I was about to wash it I noticed these weird marks that won’t wash off.. anyone else have this issue or know how to solve it?,0,1,Product Question/Recommendation,https://www.reddit.com/r/lululemon/comments/1n7myup/what_are_these_marks_on_my_water_bottle/,False,False,0.38
1n7lcwh,2025-09-03 17:34:56+00:00,actualgoddessbb,🍫 raspberries ootd,"The gym‘s been a little boring lately, so I decided to turn myself into a bratz doll to make it funner! Today’s outfit is inspired by chocolate raspberries - Define jacket in magenta smoke, size 6 ☕️ Espresso smooth cover leggings, size 6 ☕️ Espresso corset sports bra, size medium",31,8,Fit Pics,https://www.reddit.com/r/lululemon/comments/1n7lcwh/raspberries_ootd/,False,False,0.77
1n7kykk,2025-09-03 17:20:20+00:00,Financial_Law_318,Is this backpack good for school?,I’m in school right now and I need to upgrade to a bit bigger backpack as my stuff is always compacted and I need a more space and I plan to get a MacBook for school and saw this has a good pocket for your laptop. Will this backpack be good for me for school?,0,13,Product Question/Recommendation,https://www.reddit.com/r/lululemon/comments/1n7kykk/is_this_backpack_good_for_school/,False,False,0.5
1n7jk97,2025-09-03 16:29:03+00:00,Hairy-Sentence2683,So nice I bought it twice!! Like a Cloud Spaghetti + Sleek High Rise Running,Top: size 4 Shorts: XS,45,7,Fit Pics,https://www.reddit.com/r/lululemon/comments/1n7jk97/so_nice_i_bought_it_twice_like_a_cloud_spaghetti/,False,False,0.92
1n7hde1,2025-09-03 15:08:37+00:00,maddcurl,Like a cloud care,I know I’m not the only Like a Cloud lover out there. I was wondering if any of you have put yours in the dryer once every few months? I just got a new one and I’m realizing some of older ones are stretched due to pregnancy etc. thoughts? I usually wash them with Lulu items and hang dry.,2,6,Laundry,https://www.reddit.com/r/lululemon/comments/1n7hde1/like_a_cloud_care/,False,False,0.75
1n7fyzg,2025-09-03 14:14:28+00:00,After_Corgi_1644,Utility Yellow💛🧡Clementine,"Bright colors, strong energy 💛🧡🔥 finishing summer strong before the season ends ☀️💪 Utility Yellow : OS full zip hoodie (Xs/S) Clementine: Hotty hot LR 4” (4) Undertone BLK multi : WT LL (8)",35,11,Fit Pics,https://www.reddit.com/r/lululemon/comments/1n7fyzg/utility_yellowclementine/,False,False,0.93
1n7eqfb,2025-09-03 13:24:35+00:00,runandplay2,A few fave Sequoia pairings + the new WT tank 🍂🤎🧵🧁🥥,"As we all knew, sequoia is perfection and goes with so many colors. Also, begging the Lulu gods to release a camel brown color like the last pic🤞 I tried the new version of Wunder Train racerback tank and all I can say is 10/10! I took it for a 6 mile run and it was comfortable, supportive and didn’t ride up. Hoping they release more colors. Sequoia WT leggings 25 in (2) Sequoia Evolve Energy longline bra (s) Blue Twill Waffle Knit Oversized Scuba (xs/s) Pink Frosting Evolve Energy bra (s) Sequoia Wunder Train Racerback Tank (4) Blue Twill WT leggings 25 in (2) Heathered Ivory/Gold Funnel Neck long (xs/s) Warm Ash Grey Half zip cropped waffle knit (s) Lavender Frost Power Pivot Tank (xs) Blue Twill Cropped Define (4) Galactic Cobalt cropped define (6) And my favorite look but it’s not Lulu, Vuori Nutmeg",98,20,Fit Pics,https://www.reddit.com/r/lululemon/comments/1n7eqfb/a_few_fave_sequoia_pairings_the_new_wt_tank/,False,False,0.97
1n7eggu,2025-09-03 13:12:59+00:00,Huge_Top_6768,I need some insight on the Triple compartment tote bag 18L,"So I’m in university and I need a bag to take to school. I live in an area where it’s rainy and always snowing. I can’t find any reviews on this bag and was hoping that someone who owns this bag can give me any insight on it. Is the bag too bulky? Can I fit my waterbottle, laptop, iPad, chargers, headphones and more?? Pls lmk",4,3,Product Question/Recommendation,https://www.reddit.com/r/lululemon/comments/1n7eggu/i_need_some_insight_on_the_triple_compartment/,False,False,0.83
1n7eb6i,2025-09-03 13:06:46+00:00,Radish8,Sizing help for a new customer,"I've never bought from LLL before but I want to get a pair of the relaxed fit cropped dance studio pants. I have 41"" hips and in other brands' pants/jeans I am usually a medium/10/30 (occasionally a large if I want a roomier fit). The LLL size chart for this item puts me at a large. But the sizing estimator tool says a medium. Then I chatted online with CS and they recommended a medium too. I really don't know which to pick. I do want them roomier rather than form fitting, however they are already called ""relaxed fit"" and I don't want them oversized. Any advice would be appreciated!",0,12,Sizing Advice,https://www.reddit.com/r/lululemon/comments/1n7eb6i/sizing_help_for_a_new_customer/,False,False,0.5
1n7dn0z,2025-09-03 12:37:14+00:00,smoky20135,Are any of the sneakers good for over-pronating or stability?,"For reference, I usually like ASICS gel-Kayano sneakers for running purposes. I am potentially interested in sneakers from lululemon, likely NOT to run in, but for everyday wear. I would like for them to still have a decent amount of support and stability though. Are any of the lululemon sneakers good for this purpose ?",1,3,Product Question/Recommendation,https://www.reddit.com/r/lululemon/comments/1n7dn0z/are_any_of_the_sneakers_good_for_overpronating_or/,False,False,0.6
1n7d3d1,2025-09-03 12:11:49+00:00,persimmoncove,Pumpkin Spice OOTD 🍁🍂🎃,Autumn rust - align leggings (6) & longline energy bra (8) Espresso - soft stream half zip (6),183,16,Fit Pics,https://www.reddit.com/r/lululemon/comments/1n7d3d1/pumpkin_spice_ootd/,False,False,0.99
1n7bsb7,2025-09-03 11:05:03+00:00,Hairy-Sentence2683,Lulu Red set 😍,Swiftly SS: 6 HH HR 2.5: 4,79,3,Fit Pics,https://www.reddit.com/r/lululemon/comments/1n7bsb7/lulu_red_set/,False,False,0.99
1n79qog,2025-09-03 09:01:21+00:00,lululemonmods,Wednesday WMTM Wishlist Discussion,"Hey everyone, welcome to our weekly Wednesday WMTM wishlist discussion! Here we can talk all things WMTM! What are you hoping to see in Thursday's WMTM drop? Have you spotted anything in your local store? Any recommendations for what we should consider adding to our our carts on drop day? Anything and everything is welcome here! Here's to hoping all our Wednesday wishlist dreams become a reality this Thursday!",7,30,Discussion,https://www.reddit.com/r/lululemon/comments/1n79qog/wednesday_wmtm_wishlist_discussion/,True,False,0.82
1n72lwa,2025-09-03 02:09:03+00:00,CooperDoo422,Mystic 🔮☪️💜,"I ordered the Mystic Aligns from WMTM last week (was shocked to see they were $59!) They arrived Sunday and today it was cool enough to wear them! I paired them with my matching waist length Align Cami under my work shirt, but I also tried them with a couple other items for the sake of some photos too. 🤍HCULG Oversized Full-Zip Scuba Hoodie (xs/s) 🍇Chilled Grape Swiftly Tech Short-Sleeve Shirt Waist Length (6) ☪️Mystic Align Waist-Length Cami Tank Top A/B Cup (8) 🔮Mystic Align HR Pant 25"" (8) 🩶Heathered Silver Drop Daily Stride Quarter Socks (M)",83,6,Fit Pics,https://www.reddit.com/r/lululemon/comments/1n72lwa/mystic/,False,False,0.95
1n70wil,2025-09-03 00:49:54+00:00,painthrowaway852,Autumn Rust combos,"Java, Black, Ivory, and Espresso - love the way Autumn Rust pairs with the classics!",239,21,Fit Pics,https://www.reddit.com/r/lululemon/comments/1n70wil/autumn_rust_combos/,False,False,0.98
1n70bqt,2025-09-03 00:23:19+00:00,PleaseNoCilantro,Purple or Green,Stuck with a tough choice between purple pacing shorts or deep green so asking the fashionable people of Reddit for help. (Please ignore the non-matching button down and glaringly yellow shoes),11,11,Styling Advice,https://www.reddit.com/r/lululemon/comments/1n70bqt/purple_or_green/,False,False,0.82
1n701dx,2025-09-03 00:10:19+00:00,lameasfuq,Wunder Train Contour Fit... New Fabric?Less compression?,"I caved for the rich Sequoia color and bought a new pair of WT Contour Fit. They arrived today, and to my surprise, the fabric feels really different. Reminds me of my Base Pace leggings, which are some of my favorites, though for a different reason/intent. As far as I can tell, the material composition is the same (nylon and Lycra). Has anyone else noticed this? Could it have something to do with the new color? I haven’t bought a new pair in \~year, so maybe this is old news and affects all colorways. I really hope not!",6,5,Product Question/Recommendation,https://www.reddit.com/r/lululemon/comments/1n701dx/wunder_train_contour_fit_new_fabricless/,False,False,0.88
1n6zqss,2025-09-02 23:56:56+00:00,Scrappy52,Chicago/Rosement outlet,Has anyone been to the chicago lulu outlet recently? Trying to see if its worth going (during a trip to see family). Looking for mens clothes mostly Is there a best time of the week or best time of the year to go?,1,1,Discussion,https://www.reddit.com/r/lululemon/comments/1n6zqss/chicagorosement_outlet/,False,False,0.67
1n6zmzk,2025-09-02 23:52:10+00:00,TealMiche,Afterwork lifting / running errands fit,Wunder Train Leggings and Invigorate Training Tank Top in Heritage 365 Camo Tidewater Teal Multi,20,1,Fit Pics,https://www.reddit.com/r/lululemon/comments/1n6zmzk/afterwork_lifting_running_errands_fit/,False,False,0.88
1n6zbkp,2025-09-02 23:38:21+00:00,Swuishyeee,OOTD; black aligns 25” and another mile second release jacket 🖤,,24,1,Fit Pics,https://www.reddit.com/r/lululemon/comments/1n6zbkp/ootd_black_aligns_25_and_another_mile_second/,False,False,0.96
1n6v1d0,2025-09-02 20:44:00+00:00,steakandfruit,Sour Grape x Lava Cake 🍇🥮,"I saw someone do this combo here and immediately ran and bought both colors! Sour grape wonder train bra in size 2, and 6 inch align shorts in lava cake",168,7,Fit Pics,https://www.reddit.com/r/lululemon/comments/1n6v1d0/sour_grape_x_lava_cake/,False,False,0.99
1n6sxm1,2025-09-02 19:24:21+00:00,paytammy,Anyone know the name of these shorts? Are they aligns?,,23,4,Product Question/Recommendation,https://www.reddit.com/r/lululemon/comments/1n6sxm1/anyone_know_the_name_of_these_shorts_are_they/,False,False,0.92
1n6r15y,2025-09-02 18:13:33+00:00,Any-Season-9869,Swiftly Tech becoming see-through/tearing?,"My swiftly tech shirts seem to get more see through with every wash (can now see the outline of my sports bra underneath/my gold necklace if it falls under my shirt). I've only had this shirt for a little over a year (ordered May 2024). I've also started to notice runs in the fabric, specifically under the armpits-but the shirt fits fine. Does this happen to anyone else and does anyone know how to fix it?",0,3,Product Question/Recommendation,https://www.reddit.com/r/lululemon/comments/1n6r15y/swiftly_tech_becoming_seethroughtearing/,False,False,0.5
1n6pyq3,2025-09-02 17:33:53+00:00,BasicVanillaLatte,"Chilled Grape 🍇 - For us Jewel Tone Lovers and now I can’t stop singing 🎶 “Best Believe I’m still Bejeweled when I walk in the room, I can still make the whole place shimmer” 💎","I ventured out and tried the FlexyFlex Strappy Bra (A/C) and I’m not a huge fan. I needed more support, maybe sizing down would of helped but great for low support days and lounging Align HR Shorts 4” in Chilled Grape Lighting in my workout room is poor :/ my legs look soooo dark 😆 I’m a burnt pinto bean Wishing you all a great Tuesday and if you need to find your “sparkle” I hope you can in some upbeat songs and a cute workout set 🤍😘",102,13,Fit Pics,https://www.reddit.com/r/lululemon/comments/1n6pyq3/chilled_grape_for_us_jewel_tone_lovers_and_now_i/,False,False,0.9
1n6prdi,2025-09-02 17:26:21+00:00,fresh-espresso,Cozy WFH fit 🍵,Yes it’s still 83 degrees out and yes I’m blasting my AC so I can wear sweatpants 😶 Swiftly cropped tee in army green (4) Scuba joggers in heathered core medium grey (XS) - these run huge imo but so so soft and comfy,87,7,Fit Pics,https://www.reddit.com/r/lululemon/comments/1n6prdi/cozy_wfh_fit/,False,False,0.97
1n6pqir,2025-09-02 17:25:27+00:00,DeliciousAd8359,Exchange/Return for sister?,"Am I able to exchange a purchase on behalf of someone? My sister asked me to exchange a skirt for a different size. She gave me the skirt, and emailed me her receipt. Is that acceptable? She lives an hour away from the closes store and I’m close. Trying to save her some time! Thanks!",0,2,Policy,https://www.reddit.com/r/lululemon/comments/1n6pqir/exchangereturn_for_sister/,False,False,0.13
1n6oxfz,2025-09-02 16:55:21+00:00,Accomplished-Exit822,LULU a good buy?,"So it looks like they should have the LULU stock on WMTM. Yikes, it’s down 60% from its all time highs, like with many similar companies. When I like a product, I often consider buying the stock. I last bought LULU stock when they had the sheer material controversy and it did really well for me. Anyone thinking about buying some shares? It’s never been this cheap.",20,25,Discussion,https://www.reddit.com/r/lululemon/comments/1n6oxfz/lulu_a_good_buy/,False,False,0.7
1n6oaua,2025-09-02 16:32:15+00:00,cherrymargarita,Loving the old hooded Defines 🩷,"Thrifted this beautiful Define Hooded Jacket for 48 € ☺️ I think the color is Moss Rose but I’m not 100% sure. I had to resell my newer hooded Defines because they just felt thinner and weirdly not so soft, and they were missing all the nice features (hidden pocket, vent, zipper flaps —> if these have an actual name please educate me lol) that the older ones have.",126,20,Fit Pics,https://www.reddit.com/r/lululemon/comments/1n6oaua/loving_the_old_hooded_defines/,False,False,0.98
1n6mptk,2025-09-02 15:32:54+00:00,persimmoncove,This mornings OOTD,Omg I almost forgot to post this morning! 🙈 True navy - WT leggings & ebb street tank W/ light ivory trim (both size 6) Aero Blue - funnel neck scuba (6),72,15,Fit Pics,https://www.reddit.com/r/lululemon/comments/1n6mptk/this_mornings_ootd/,False,False,0.95
1n6klgn,2025-09-02 14:12:35+00:00,LIPSBEAST,Tiger Red print 🐅❗️,Finally found a print for men that I like so I bought it on drop day! Think I might go back for the blue one too 😂 Soft Jersey Short-Sleeve Shirt in Heathered Hot Heat/Heathered Twilight Rose Ventilated Tennis Short 7” in Animal Mesh Lulu Red Multi,39,9,Fit Pics,https://www.reddit.com/r/lululemon/comments/1n6klgn/tiger_red_print/,False,False,0.95
1n6ki9v,2025-09-02 14:09:04+00:00,After_Corgi_1644,💚Maldives Green🌴Palm Court,Palm Court : OS Full zip hoodie (Xs/S) Maldives Green: Power Thru 6” (4) Ribbed asymmetrical bra (8),45,3,Fit Pics,https://www.reddit.com/r/lululemon/comments/1n6ki9v/maldives_greenpalm_court/,False,False,0.97
1n6jtcn,2025-09-02 13:42:05+00:00,runandplay2,Still my favorite combo 🌊🍋‍🟩🍋,Can’t say goodbye to this one yet! I can’t decide if I like the matching set with Citra lime bra or the cropped swiftly. Went with the cropped swiftly for my workout 🍋‍🟩🌊 Pool Party Power Pivot Tank (xs) Pool Party Wt leggings (4) Citra Lime Evolve Energy Bra (s) Citra Lime Cropped Swiftly (4),152,25,Fit Pics,https://www.reddit.com/r/lululemon/comments/1n6jtcn/still_my_favorite_combo/,False,False,0.99
1n6jsco,2025-09-02 13:41:02+00:00,BroncoDude556,Chicago Print,"New Chicago print on black Steady State Crew. Also on white crew, black and white shirts, and black EBBs. No upcharge from the regular price either.",9,0,In-Store Find,https://www.reddit.com/r/lululemon/comments/1n6jsco/chicago_print/,False,False,0.77
1n6jmaa,2025-09-02 13:34:09+00:00,Complex-Wrangler8884,Align Scoop Waist Length Tank,I got this a few days ago and it is perfection. Actually buttery soft + fits my body like a glove! I’m usually a size 10 but an 8 was perfect for me! Definitely recommend. The neckline is also perfect for my C/D cup girlies. Need it in more colors! Top- Align Scoop Waist Length Tank Top // size 8 // white,64,8,Review,https://www.reddit.com/r/lululemon/comments/1n6jmaa/align_scoop_waist_length_tank/,False,False,0.96
1n6jaml,2025-09-02 13:20:50+00:00,Swuishyeee,Does the cropped define jacket still fit cropped on someone who’s 5’2 or just fits better than a regular length define?,,1,12,Sizing Advice,https://www.reddit.com/r/lululemon/comments/1n6jaml/does_the_cropped_define_jacket_still_fit_cropped/,False,False,0.57
1n6hyb8,2025-09-02 12:20:31+00:00,Complex-Wrangler8884,Not making enough money,"This post is really for those who are employed at lululemon. I work for the company and have been for 4 years now. I truly think we don’t make shit dealing with guests every single day who 1, are disrespectful as FVCK + act so entitled to shit that has nothing to do with our job role. lululemon is a billion dollar company and they can’t even pay their employees right. On a day to day basis, the people we are expected to tolerate does not meet the pay and I’m tired of it. I feel like it is hitting me now because my paychecks just suck and I cannot afford it anymore. Also the fact that the holidays and peak season is coming up makes me want to vomit everywhere. I think I’m done with the guest facing roles and need something else. I know a few people have shared their stories of working for this company, curious where everyone works now (if you don’t mind sharing). I need something else…",57,80,Discussion,https://www.reddit.com/r/lululemon/comments/1n6hyb8/not_making_enough_money/,False,False,0.7
1n6egvw,2025-09-02 09:00:53+00:00,lululemonmods,Tuesday Drop Discussion,"Hi everyone! Welcome to the official **Tuesday Drop Discussion**! Chat here about your reactions to the new drop, what you're planning on buying (or not buying...), and anything and everything in between! ———————— **Please keep all links and discussion around the new drop in the comments. Sort comments by new as the drop is happening to see any new releases.** ———————— **Tips and Tricks:** \- If something isn't showing up for you, search by item/color name, open the link, delete everything after product name and refresh. You may need to do this a couple of times. If that doesn't work, try clearing cache and cookies and try again. \- Edit in cart trick: Add the item you want in any size and color to your cart, and then once it's in your cart change it to color you want. \- Don't look at the What's New page, use the site search bar. \- The app is laggy, use the website. \- The new drop has generally been starting around 2:10 p.m. EST in the U.S. and just after 3 p.m. EST in Canada, but sometimes (very infrequently) it varies. \- USA and Canada pretty much always get the same new items, just as mentioned above, Canada's drop happens around 40 minutes later, thus there's no Canada thread. Good luck and happy shopping! 🥰",12,164,Discussion,https://www.reddit.com/r/lululemon/comments/1n6egvw/tuesday_drop_discussion/,False,False,0.83
1n6ayia,2025-09-02 05:14:31+00:00,Ok-Entertainment2640,PINKS,"I really want a matching pink set but I realized the Pink Frosting is completely the same as Magenta Glow, can anyone confirm? Do you have both? If it's the same or super close, i'd just buy the pants then. Thanks!",10,1,Styling Advice,https://www.reddit.com/r/lululemon/comments/1n6ayia/pinks/,False,False,0.82
1n694am,2025-09-02 03:31:46+00:00,Prestigious_Bed9823,Padel outfit 🤞🏼,Lightweight high-rise tennis skirt (6) and power pivot training top (L) both in lavender frost💜,32,2,Fit Pics,https://www.reddit.com/r/lululemon/comments/1n694am/padel_outfit/,False,False,0.86
1n6947f,2025-09-02 03:31:38+00:00,PatientGuava007,Help me make a match!,What colors are close enough to Blissful Pink in order to match? I’d love a matching set in this but it doesn’t look like they have made the shorts in it yet.,3,5,Styling Advice,https://www.reddit.com/r/lululemon/comments/1n6947f/help_me_make_a_match/,False,False,0.67
1n65mqu,2025-09-02 00:40:21+00:00,InternationalSafe552,does anyone know what pants these are😇🩷 TIA,,19,7,Product Question/Recommendation,https://www.reddit.com/r/lululemon/comments/1n65mqu/does_anyone_know_what_pants_these_are_tia/,False,False,0.86
1n64f64,2025-09-01 23:43:19+00:00,nululumumumelon,"[image trick finds] EtS Tank (BLTW), EtS cropRB (SRNB), CatesT (TRQB), LaC / loveCrw / HT SS / softstremeHRpant reg+shrt /alignNoLineHR25"" (SQUO), HT LS (nutmeg), defineNuluCrop (GGRE), alignHR23"" / alignHR25"" (PLMD), alignNoLineHR28"" (ESPR), TT MRlnd5"" (BALF), alignHR4"" /alignHR6"" /GU SHR 25"" (ROWD",,73,23,Unreleased Item,https://www.reddit.com/r/lululemon/comments/1n64f64/image_trick_finds_ets_tank_bltw_ets_croprb_srnb/,False,False,0.98
1n6407b,2025-09-01 23:24:00+00:00,nululumumumelon,"[image trick finds] AE SS (SQUO), SS POH (SOGY), ZIpnt (GRSG), PBlnrlss5"" (SQUO), EBBlong1L (BRML, calypso pink), EBBextnd (calypso pink), EBBlg (MINK), SlouchySlng6L (BALF, BRML), SlouchySlng13L (BRML), CEminiBag1L (BRML, black plum, BLLP), scubaOSFZH (WSHG, BLTW), scubaMROSJggr Shrt&Tll (SQUO), sc",,61,21,Unreleased Item,https://www.reddit.com/r/lululemon/comments/1n6407b/image_trick_finds_ae_ss_squo_ss_poh_sogy_zipnt/,False,False,0.98
1n614p9,2025-09-01 21:20:33+00:00,Superb-Invite-6182,Compare delicate mint & mint breeze?,Lmk if yo,0,0,Request,https://www.reddit.com/r/lululemon/comments/1n614p9/compare_delicate_mint_mint_breeze/,False,False,0.25
1n60v75,2025-09-01 21:10:07+00:00,jacknicholscum,Still summer 🩵💚,One of my favorite pairings: Citra Lime (Energy Evolve longline bra) + Tropics Tone (4” Align short) Happy Labor Day everyone 🙏🏽,125,6,Fit Pics,https://www.reddit.com/r/lululemon/comments/1n60v75/still_summer/,False,False,0.95
1n6045y,2025-09-01 20:41:03+00:00,Minimum_Meal4378,Hang or fold,"Is it best to hang or fold metal Vent shirts. My main concern is stretch, stretching or sagging of the neck and shoulders.",0,2,Product Question/Recommendation,https://www.reddit.com/r/lululemon/comments/1n6045y/hang_or_fold/,False,False,0.5
